Pattern Name,Problem,Context,Solution,Result,Related Patterns,Uses,Cluster Number,Category
Conversable Agents,"Designing individual agents that are capable, reusable, customizable, and effective in multi-agent collaboration within LLM applications.","Building multi-agent LLM applications where agents need to interact, provide feedback, and make progress through conversation.","Implement a generic agent design that can leverage LLMs, human inputs, tools, or a combination thereof. Make agents 'conversable' so they can receive, react, and respond to messages, maintaining internal context. Allow for convenient creation of agents with different roles or responsibilities through configuration or extension.","Enables modular combination of broad LLM capabilities, allows agents to hold multi-turn conversations autonomously or with human involvement, and facilitates the creation of specialized agents for diverse tasks.","['Conversation Programming', 'Unified Conversation Interfaces and Autoreply Mechanisms', 'Composable Conversation Patterns']","General multi-agent LLM application development, role-playing scenarios, task-specific agents (e.g., AssistantAgent, UserProxyAgent).",2,
Conversation Programming,Streamlining the development of complex LLM applications that rely on multi-agent interactions and require flexible control over conversation flow and agent actions.,Developing intricate multi-agent systems where workflows are best expressed as inter-agent conversations rather than rigid sequences.,"Adopt a programming paradigm centered around inter-agent conversations. This involves two primary steps: 1) defining a set of conversable agents with specific capabilities and roles, and 2) programming the interaction behavior between agents via conversation-centric computation and control, using a fusion of natural language and code.","Simplifies and unifies complex LLM applications, facilitates intuitive reasoning about complex workflows through agent actions and message passing, and supports flexible multi-agent conversation patterns.","['Conversable Agents', 'Unified Conversation Interfaces and Autoreply Mechanisms', 'Control by Fusion of Programming and Natural Language', 'Composable Conversation Patterns']","General multi-agent LLM application development, defining complex workflows, agent interaction scripting.",2,
Unified Conversation Interfaces and Autoreply Mechanisms,"Managing the communication and control flow in multi-agent systems in a decentralized, modular, and unified way, without requiring a separate, complex control plane.","Agents needing to send, receive, and generate replies in multi-turn conversations, where the conversation flow should be naturally induced by agent interactions.","Provide low-level, unified conversation interfaces (`send/receive`, `generate_reply`, `register_reply`). Implement a default 'agent autoreply mechanism' where an agent automatically invokes `generate_reply` and sends a response after receiving a message, unless a termination condition is met. Allow registration of custom reply functions to customize agent behavior.","Enables automated agent chats, simplifies workflow definition, and supports dynamic, conversation-driven control flow.","['Conversable Agents', 'Conversation Programming', 'Composable Conversation Patterns']","Automated agent chats, dynamic workflow definition, custom agent behaviors (e.g., nested chat implementation).",2,
Control by Fusion of Programming and Natural Language,"Achieving flexible and powerful control over multi-agent conversation flow, leveraging the strengths of both human-readable natural language instructions and precise programmatic logic.","Multi-agent systems where LLM-backed agents, human inputs, and tool executions interact, requiring adaptable control mechanisms.","Provide natural language control via prompting LLM-backed agents with instructions (e.g., system messages for role-playing, debugging, output confinement). Enable programming language control using code to specify termination conditions, human input modes, tool execution logic, or custom autoreply functions. Support seamless control transition between natural language and code (e.g., LLM inference with control logic in a reply function, LLM-proposed function calls triggering code).","Enables sophisticated and adaptive control over agent interactions, allowing for dynamic adjustments and complex logic that leverages both human intuition and computational precision.","['Conversation Programming', 'Conversable Agents', 'Unified Conversation Interfaces and Autoreply Mechanisms']","Guiding agent behavior, implementing complex decision trees, dynamic debugging, integrating human oversight, LLM function calling.",2,
Composable Conversation Patterns,"Building multi-agent applications that require diverse interaction structures (static or dynamic, simple or complex) beyond basic back-and-forth dialogues.","Designing multi-agent systems for varying application complexities, such as single-turn, multi-turn, human-involved, or dynamically evolving conversations.","Provide high-level interfaces for commonly used conversation patterns like Two-Agent Chat, Sequential Chat, Nested Chat, and Group Chat. Allow these patterns to be composed recursively using low-level interfaces (like `register_reply`) to create more complex and creative patterns. Enable dynamic conversation flows through custom reply functions, speaker transition conditions, and LLM-driven function calls.","Supports a broad spectrum of application needs, from simple two-agent interactions to complex, dynamically evolving multi-agent collaborations, enhancing flexibility and generalizability.","['Conversation Programming', 'Unified Conversation Interfaces and Autoreply Mechanisms']","Math problem solving (two-agent), retrieval-augmented QA (two-agent), decision making in embodied agents (two/three-agent), supply chain optimization (three-agent), dynamic task solving (group chat), conversational chess (multi-agent); implementing inner monologues or self-reflection (nested chat).",2,
Human-in-the-Loop Multi-Agent Systems,"Effectively integrating human feedback, guidance, and oversight into multi-agent AI workflows to improve performance, ensure safety, and enable collaborative problem-solving.","Challenging tasks where fully autonomous AI systems may fail, require validation, or where human expertise is essential. Scenarios involving multiple human users collaborating with AI agents.","Configure a UserProxyAgent to solicit human inputs at specific rounds or conditions (e.g., `human_input_mode=ALWAYS`). Enable multi-user participation by designing agents (e.g., Student, Expert) that can interact with the system and with each other, mediated by AI assistants.","Enhances the system's ability to solve complex problems, incorporates human intelligence, provides guardrails, improves user experience, and allows for interactive user instructions and multi-user collaboration.","['Conversable Agents', 'Composable Conversation Patterns']","Math problem solving (correcting LLM errors, multi-user scenarios), dynamic task solving, conversational games (AI-human chess), general AI oversight.",45,
Interactive Retrieval,"Mitigating the intrinsic limitations of LLMs (e.g., hallucination, outdated knowledge, lack of domain-specific context) in retrieval-augmented generation (RAG) systems when initial retrieval is insufficient.","Question-answering or code generation tasks where LLMs need to access external, up-to-date, or private knowledge bases, and the first attempt to retrieve relevant information might not be enough.","Design the LLM-backed assistant to explicitly signal 'UPDATE CONTEXT' when it cannot find information in the current context. This signal triggers a user proxy agent (or another specialized agent) to perform additional retrieval attempts (e.g., fetching next most similar document chunks) and provide updated context to the assistant.","Dynamically updates the context for the LLM, significantly boosting performance on QA and code generation tasks, and improving the LLM's ability to provide accurate and relevant responses.",[],"Natural language question answering, code generation based on private or latest codebases.",1,
Grounding Agent,"Preventing LLM-based agents from making commonsense errors, getting stuck in repetitive error loops, or violating task-specific rules in interactive decision-making environments.","Embodied agents or game-playing AI systems operating in environments that require adherence to physical laws, common sense, or explicit game rules.","Introduce a specialized 'grounding agent' that acts as a knowledge source or rule validator. This agent provides crucial commonsense knowledge or checks proposed actions for legality, intervening dynamically (e.g., when recurring errors are detected, or an illegal move is suggested) to guide the decision-making agent.","Significantly enhances the system's ability to avoid error loops, ensures adherence to rules (e.g., game integrity), and improves decision-making by supplying necessary external knowledge.",['Executor Agent'],"Decision making in embodied agents (ALFWorld), conversational games (Chess), preventing flawed plans.",43,
Adversarial/Collaborative Agent Interactions,"Ensuring robustness, safety, and quality in complex multi-agent tasks, especially those involving creative generation (like code) where errors or unsafe outputs are possible.","Tasks requiring a combination of generation, interpretation, and critical review or validation, such as software development or optimization solution interpretation.","Design a multi-agent system where some agents work collaboratively to generate solutions (e.g., a 'Writer' for code and interpretation, a 'Commander' for coordination) while others act adversarially to check for safety, errors, or adherence to constraints (e.g., a 'Safeguard' agent for code safety). Information is shared in a controlled manner between these roles.","Boosts performance (e.g., F1 score in identifying unsafe code), reduces errors, promotes modularity, and ensures a higher quality and safer output.",['Composable Conversation Patterns'],"Supply chain optimization (code generation and safety checks), software engineering tasks.",43,
Executor Agent,Decoupling the high-level decision-making and planning logic from the low-level interaction and execution within an external environment.,"Online decision-making tasks where an AI agent needs to perform actions in a simulated or real-world environment (e.g., embodied agents, web interaction tasks).","Implement a dedicated 'executor agent' that is responsible for: 1) receiving high-level action decisions from a planning/assistant agent, 2) translating and executing these actions in the environment, and 3) reporting the environment's state, observations, or feedback back to the decision-making agent. The assistant agent then focuses solely on planning and reasoning.","Simplifies the development of decision-making agents, allows for reuse of planning logic across different environments (with different executors), and streamlines agent-environment interactions by clearly separating concerns.",['Grounding Agent'],"Decision making in embodied agents (ALFWorld), online decision making in web interaction tasks (MiniWoB), robotics.",43,
Adaptive Retrieval-Augmented Generation (AdaptiveRAG),"Retrieval-Augmented Large Language Models (LLMs) often employ a 'one-size-fits-all' strategy, which leads to inefficiencies for simple queries (unnecessary computational overhead) or inadequacies for complex, multi-step queries (failure to address them effectively). Real-world user requests exhibit a wide range of complexities, making static approaches suboptimal.","LLM-based applications, particularly in Question Answering (QA), that need to deliver accurate and efficient responses by incorporating external knowledge, where the incoming user queries vary significantly in their complexity (from straightforward to multi-hop reasoning).","A novel adaptive framework that dynamically selects the most suitable retrieval-augmented LLM strategy based on the assessed complexity of the incoming query. This selection is operationalized by a 'Query Complexity Classifier' and allows for adaptation between three core strategies: 1) A non-retrieval approach for straightforward queries, 2) A single-step retrieval approach for queries of moderate complexity requiring external knowledge, and 3) A multi-step (iterative) retrieval approach for complex queries necessitating extensive reasoning and information synthesis from multiple sources.","Enhances the overall efficiency and accuracy of QA systems by balancing computational resources with task requirements. It provides a robust middle ground, preventing unnecessary overhead for simple queries while ensuring comprehensive handling of complex ones.",Query Complexity Classifier,"Open-domain Question Answering, intelligent chatbots, dynamic resource management for LLM services, personalized AI model routing.",46,
Query Complexity Classifier,"Dynamically adapting AI system strategies (e.g., choosing between different RAG methods) requires an automated and accurate assessment of the input query's complexity. However, pre-annotated datasets for query-complexity pairs are typically unavailable, making supervised training challenging.","AI systems, such as adaptive RAG frameworks, that need to adjust their operational behavior or select appropriate sub-models based on the intrinsic difficulty or type of the input query, in scenarios where human-labeled complexity data is scarce.","Train a smaller, dedicated Language Model (Classifier) to predict the complexity level of a given query. The training dataset for this classifier is automatically constructed without human labeling by leveraging two main strategies: 1) 'Outcome-based labeling' (silver data) where queries are labeled based on the successful performance of different existing AI strategies (e.g., if a non-retrieval LLM answers correctly, it's 'straightforward'). Simpler models are prioritized in case of ties. 2) 'Inductive bias labeling' where inherent characteristics of existing benchmark datasets (e.g., queries from single-hop QA datasets are labeled 'moderate', multi-hop datasets are labeled 'complex') are used to assign labels to previously unlabeled queries.","Enables the dynamic selection of optimal AI strategies by providing an automated and resource-efficient mechanism for query complexity assessment. This leads to improved overall performance and efficiency of the adaptive AI system, and reduces the dependency on costly manual data annotation.",Adaptive Retrieval-Augmented Generation (AdaptiveRAG),"Adaptive RAG, dynamic routing in conversational AI, intelligent workload distribution for AI inference, context-aware model selection.",46,
Interpretability-Constrained Learning,"Achieving high accuracy with black-box models often sacrifices interpretability, leading to a lack of understanding and trust in critical applications.","Designing and training AI/ML models, especially for high-risk applications (e.g., healthcare, finance, criminal justice), where both high performance and inherent interpretability are non-negotiable requirements.","Integrate interpretability criteria (e.g., model size, number of nodes/rules, number of non-zero weights) directly into the model's optimization problem during training, typically as a penalty term in the loss function or as explicit constraints.","Develops models that are inherently transparent and understandable by design, while still striving for high predictive performance, overcoming the traditional accuracy-interpretability tradeoff.",[],"Healthcare, criminal justice, finance, ethical AI, applications requiring regulatory compliance (e.g., GDPR 'right to explanation').",37,
Global Surrogate Model,"Understanding the overall logic and global behavior of a complex, black-box AI model that cannot be directly inspected.","When a high-performing black-box model is deployed, and a holistic, high-level understanding of its decision-making process across the entire dataset is required, for purposes like auditing or general comprehension.","Train a simpler, inherently interpretable model (e.g., decision tree, rule-based model) on the predictions generated by the original black-box model across the entire dataset. This interpretable model acts as a 'surrogate' that mimics the black-box model's global behavior.","Provides a global, understandable approximation of the black-box model's logic, offering insights into its overall decision-making patterns.","['Local Surrogate Model', 'Local Rule-Based Explanation']","Model auditing, general model understanding, compliance, comparing overall model behaviors.",3,
Local Surrogate Model,"Explaining why a specific individual prediction was made by a complex, black-box AI model, as its global behavior may be too complex to understand or faithfully mimic.","When a detailed, instance-level explanation is needed for a black-box model's output, especially for critical decisions, without needing to understand the entire model's logic.","In the vicinity of the specific instance to be explained, generate a local dataset (e.g., through perturbed samples or nearest neighbors). Then, train a simple, interpretable model (e.g., linear model, rule-based model) on this local dataset, using the black-box model's predictions as labels, to approximate the black-box model's behavior *only in that locality*.","Provides instance-specific, understandable explanations (e.g., feature importances, local rules) that are locally faithful to the black-box model's decision for that particular instance.","['Global Surrogate Model', 'Local Rule-Based Explanation', 'Shapley Value Explanation', 'Human-in-the-Loop Explanation']","Debugging individual predictions, building trust, human-in-the-loop decision support, understanding specific decision boundaries.",3,
Shapley Value Explanation,"Quantifying the fair and consistent contribution of each feature (or group of features) to a specific individual prediction from a black-box AI model, accurately reflecting feature interactions.","When a precise, fair, and axiomatic allocation of responsibility for an individual prediction across its input features is required, especially when feature interactions are significant.","Apply the Shapley value concept from cooperative game theory, treating input features as players in a game and the prediction (or prediction probability) as the game's payout. The Shapley value for a feature is its average marginal contribution across all possible permutations (coalitions) of features.","Provides a unique, fair, and consistent attribution of an individual prediction to its input features, inherently capturing interaction effects, which can be summarized in a feature importance vector.","['Local Surrogate Model', 'Local Rule-Based Explanation', 'Divergent Subgroup Analysis']","Explaining individual predictions, fairness analysis (e.g., for bias detection), understanding feature impact, model auditing.",22,
Local Rule-Based Explanation,"Providing an easily understandable, qualitative explanation for an individual prediction of a black-box AI model, highlighting specific combinations of feature values that led to the decision.","When human users (e.g., domain experts, end-users) need clear, logical 'if-then' rules to understand the local reasons for an AI model's decision, often for debugging, trust-building, or compliance.","Derive a set of simple, human-interpretable 'if-then' rules that accurately describe the black-box model's behavior in the local neighborhood of a specific instance. These rules capture the relevant associations of attribute values with the predicted class. The rules can be extracted from a local surrogate model (e.g., an associative classifier or decision tree) trained on local data.","Offers qualitative insights into individual predictions through interpretable rules, making the decision-making process transparent at an instance level and revealing specific feature value configurations that drive a decision.","['Local Surrogate Model', 'Human-in-the-Loop Explanation']","Human-in-the-loop inspection, debugging specific predictions, trust-building, compliance (e.g., GDPR 'right to explanation').",3,
Counterfactual Explanation,"Explaining why a specific prediction was made by an AI model and, more importantly, identifying the minimal changes to the input features that would alter that prediction to a desired alternative outcome.","When users need actionable guidance on how to achieve a different AI outcome (e.g., 'What if I had done X instead of Y?'), or for auditing models for potential biases by seeing what minimal changes would flip a discriminatory decision.","Given an instance and its prediction, search for a new, synthetic instance that is as close as possible to the original instance (e.g., in feature space) but results in a different, desired prediction from the black-box model. The differences between the original and the counterfactual instance form the explanation.","Provides intuitive and actionable explanations by showing the 'what-if' scenarios, enabling users to understand decision boundaries and potentially influence future AI outcomes.",['Human-in-the-Loop Explanation'],"User guidance for decision-making, fairness auditing, understanding decision boundaries, policy making, debugging.",45,
Divergent Subgroup Analysis,"Identifying and characterizing specific data subgroups where an AI model exhibits a significantly different or anomalous behavior (e.g., higher error rates, lower accuracy, specific biases) compared to its overall performance.","When auditing AI models for fairness, validating performance across diverse populations, debugging unexpected behaviors in specific data segments, or trying to uncover hidden biases not tied to predefined protected attributes.","Systematically explore a large number of data subgroups (often defined by combinations of attribute values, i.e., patterns or itemsets). For each subgroup, quantify its 'divergence' by comparing a chosen performance metric (e.g., false positive rate, false negative rate, accuracy) within the subgroup to the same metric calculated over the entire dataset. This often involves leveraging efficient data mining techniques (like frequent pattern mining) to find sufficiently represented subgroups and statistical tests to assess significance.","Reveals critical data segments where the model performs poorly or exhibits bias, enabling targeted debugging, fairness interventions, and model improvement. It can also identify 'corrective items' that reduce divergence when added to a pattern.","['Shapley Value Explanation', 'Human-in-the-Loop Explanation']","Model validation, fairness auditing, bias detection, error analysis, targeted interventions, understanding model generalization.",45,
Human-in-the-Loop Explanation,"AI systems, especially black-box models, often lack transparency, hindering human understanding, trust, and the ability of domain experts to debug or improve them.","Designing and deploying AI systems in critical applications where continuous human oversight, validation, debugging, and collaboration with AI are essential, and where users need to actively investigate and query AI decisions.","Implement interactive interfaces and tools that allow users to: Actively query and inspect AI explanations (e.g., local rules, feature importances) for individual predictions or specific data subgroups; Perform 'what-if' analyses by interactively changing input features and observing the impact on predictions and explanations; Test their own hypotheses or user-defined rules against the model's behavior; Compare explanations across different models or for different target classes; Aggregate local explanations to gain global insights.","Fosters trust, facilitates model debugging, allows for active hypothesis testing, supports continuous learning and improvement of AI systems based on human feedback, and enables expert-AI collaboration.","['Local Rule-Based Explanation', 'Counterfactual Explanation', 'Divergent Subgroup Analysis']","Model validation, debugging, trust-building, compliance, expert-AI collaboration, active learning, policy making.",45,
