Pattern Name,Problem,Context,Solution,Result,Related Patterns,Uses,Cluster Number,Category
LLMPlanner (Embodied Agent Few-Shot Grounded Planning),"Building versatile, sample-efficient embodied agents that can follow natural language instructions for complex, long-horizon tasks in diverse, partially observable environments. Existing methods require large amounts of labeled data, and static plans lack environmental grounding, leading to failures.","Embodied agents (e.g., robots, virtual agents) operating in dynamic, visually-perceived environments, needing to execute multi-step instructions from natural language with minimal task-specific training data.","Implement a hierarchical planning framework where a Large Language Model (LLM) serves as a few-shot high-level planner, directly generating sequences of subgoals. This planning is continuously refined by a dynamic 'grounded replanning' algorithm that updates the plan based on real-time environmental observations (e.g., perceived objects) and execution failures, feeding this context back into the LLM prompt. The solution leverages in-context learning with dynamic example retrieval and logit biases for robust plan generation.","Dramatically reduces the need for human annotations and training data, enabling versatile and sample-efficient embodied agents that can dynamically adapt their plans to the current environment, overcome unforeseen challenges, and achieve competitive performance with significantly less data.","['Hierarchical Planning for Embodied Agents', 'LLM as a Planner', 'Grounded Replanning (with LLMs)', 'In-Context Learning for Agent Planning', 'Dynamic In-Context Example Retrieval', 'Logit Biases for LLM Output Constraint']","Embodied AI, Robotics, Vision-and-Language Navigation, Autonomous Agents, Task Automation, Few-Shot Learning for Robotics",32,"Agentic AI, LLM-specific, Planning, Knowledge & Reasoning, Prompt Design"
Hierarchical Planning for Embodied Agents,"Directly planning complex, long-horizon tasks for embodied agents from high-level natural language instructions to low-level primitive actions is computationally intractable, difficult to generalize, or requires extensive domain knowledge.","Embodied agents (e.g., robots, virtual agents) needing to perform multi-step, complex tasks in dynamic environments.","Decompose the overall planning process into two distinct layers: a High-Level Planner that interprets natural language instructions and generates a sequence of abstract subgoals (e.g., 'Navigate to object X', 'Pickup object Y'), and a Low-Level Planner that translates each subgoal into a sequence of primitive, executable actions within the current environment state. The high-level plan makes low-level planning conditionally independent of the initial natural language instruction.","Simplifies the complex planning problem, allows for modular development and different specialized models for high-level (e.g., LLMs, symbolic AI) and low-level (e.g., classical planners, trained policies) tasks, and improves scalability for long-horizon tasks.","['LLMPlanner (Embodied Agent Few-Shot Grounded Planning)', 'LLM as a Planner', 'Grounded Replanning (with LLMs)']","Vision-and-Language Navigation, Robotics, Autonomous Agents, Complex Task Execution",47,"Planning, Agentic AI, Classical AI"
LLM as a Planner,"Generating flexible, human-interpretable, and executable plans for agents from natural language instructions often requires extensive domain-specific rule engineering, large datasets of plan-action pairs, or pre-defined admissible action lists, which are difficult to obtain or manage in complex, partially observable environments.","Agentic systems where natural language instructions need to be translated into a sequence of executable steps (plans or subgoals), often in dynamic or open-ended environments.","Leverage a Large Language Model (LLM) to directly generate a sequence of high-level actions, subgoals, or a full plan in response to a natural language instruction. This is typically achieved through careful prompt engineering, allowing the LLM to use its vast pre-trained knowledge and in-context examples to infer plausible and executable plans.","Enables few-shot or zero-shot planning, reduces reliance on explicit domain models or large training datasets, and allows for more natural language interaction with the agent. The LLM's commonsense knowledge can produce contextually plausible plans.","['LLMPlanner (Embodied Agent Few-Shot Grounded Planning)', 'Hierarchical Planning for Embodied Agents', 'Grounded Replanning (with LLMs)', 'In-Context Learning for Agent Planning']","Embodied AI, Robotics, Conversational Agents, Task Automation, Agentic AI",32,"LLM-specific, Planning, Agentic AI"
Grounded Replanning (with LLMs),"Static plans generated by high-level planners (especially LLMs) may lack physical grounding, failing when confronted with the actual, dynamic, or partially observed environment (e.g., an object is not found, an obstacle blocks a path, or the environment state differs from initial assumptions). This leads to execution failures and an inability to complete tasks.",Embodied or autonomous agents executing pre-generated plans in real-world or simulated environments where unforeseen circumstances or discrepancies between the plan's assumptions and reality can occur.,"Implement a feedback loop where the agent continuously monitors its execution progress and the environment state. When an execution failure or significant deviation occurs (e.g., taking too long to reach a subgoal, failed action, or a critical object is not found), the high-level planner (an LLM) is dynamically re-prompted. This re-prompt includes the original instruction, the partially completed plan, and crucially, real-time observations from the environment (e.g., a list of currently visible objects). The LLM then generates a new, grounded continuation of the plan, adapting to the current reality.","Enables agents to dynamically adapt to environmental changes, recover from execution failures, resolve ambiguities (e.g., finding an object in an alternative location), and produce more robust and physically grounded plans, leading to higher task completion rates and a closed-loop interaction between the agent and its environment.","['LLMPlanner (Embodied Agent Few-Shot Grounded Planning)', 'LLM as a Planner', 'Hierarchical Planning for Embodied Agents', 'Logit Biases for LLM Output Constraint']","Embodied AI, Robotics, Autonomous Navigation, Adaptive Planning, Error Recovery in Agent Systems",16,"Agentic AI, LLM-specific, Planning, Knowledge & Reasoning"
In-Context Learning for Agent Planning,"Effectively leveraging the capabilities of Large Language Models (LLMs) for specific, structured tasks like agent planning without resource-intensive fine-tuning or requiring large task-specific datasets, especially in few-shot settings.","Utilizing pre-trained LLMs for downstream tasks, particularly in scenarios with limited labeled data (few-shot setting) where the desired output is a structured plan or sequence of actions for an agent.","Craft a prompt that explicitly guides the LLM to generate the desired plan. This prompt typically includes: 1) An explicit instruction explaining the task to the LLM, 2) A clear definition of allowed actions or the expected output format, and 3) A small set of high-quality, relevant input-output examples (e.g., natural language instruction-plan pairs) placed directly within the prompt, demonstrating the desired planning behavior.","Enables LLMs to perform few-shot planning, significantly reducing the need for task-specific training data and development time. This allows for rapid prototyping and adaptation of agent behaviors by simply modifying prompts and examples.","['LLMPlanner (Embodied Agent Few-Shot Grounded Planning)', 'Dynamic In-Context Example Retrieval', 'Logit Biases for LLM Output Constraint']","Few-shot learning, Prompt Engineering, Rapid Development of LLM-powered Agents, Task-Specific LLM Adaptation",32,"Prompt Design, LLM-specific, Classical AI"
Dynamic In-Context Example Retrieval,"The effectiveness of in-context learning with LLMs is highly dependent on the quality and relevance of the provided examples. A fixed set of examples may not be optimal for diverse inputs, leading to suboptimal or inconsistent performance across different tasks or instructions.","Implementing in-context learning with LLMs for various tasks, especially when dealing with a varied set of user instructions or tasks, and a larger pool of potential demonstration examples is available.","Instead of using a static set of in-context examples, dynamically select the most relevant examples for each specific test input. This typically involves: 1) Encoding the test input (e.g., the natural language instruction) into an embedding, 2) Comparing this embedding to pre-computed embeddings of a pool of available training examples, and 3) Retrieving the top-K most similar examples (e.g., using k-nearest neighbors based on cosine or Euclidean distance) to include in the LLM's prompt.","Improves the overall performance, robustness, and consistency of in-context learning by ensuring that the LLM receives demonstrations that are highly pertinent to the current task, leading to more accurate and appropriate outputs.","['LLMPlanner (Embodied Agent Few-Shot Grounded Planning)', 'In-Context Learning for Agent Planning']","Few-shot learning, Prompt Engineering, LLM-based systems, Contextual AI",32,"Prompt Design, LLM-specific, Classical AI"
Logit Biases for LLM Output Constraint,"When LLMs are used for structured tasks like agent planning, their unconstrained natural language generation can produce outputs that are syntactically incorrect, semantically irrelevant, or contain tokens (e.g., actions, objects) not valid in the current context or environment. This leads to unexecutable or nonsensical results.","Utilizing LLMs for tasks requiring specific output formats, adherence to a defined vocabulary (e.g., a set of allowed actions, recognized objects), or where certain tokens should be prioritized based on external, real-time information.","Apply 'logit biases' during the LLM's generation process. This involves programmatically adjusting the probability scores (logits) of specific tokens before sampling, increasing the likelihood of desired tokens (e.g., known high-level actions, currently observed objects) and decreasing the likelihood of undesired ones. This bias can be based on a dynamically compiled list of admissible tokens from the environment or a predefined action space.","Guides the LLM to produce outputs that are more aligned with the desired structure and available context, improving the executability and correctness of generated plans. It also aids in disambiguation (e.g., selecting 'TableLamp' over 'FloorLamp' if 'TableLamp' is the only observed lamp) and grounding the LLM's output to the physical environment.","['LLMPlanner (Embodied Agent Few-Shot Grounded Planning)', 'Grounded Replanning (with LLMs)', 'In-Context Learning for Agent Planning']","Prompt Engineering, Constrained Text Generation, Structured Output from LLMs, Agent Planning, Object Disambiguation",6,"Prompt Design, LLM-specific, Tools Integration"
Retrieval-Augmented Generation (RAG),"Large pretrained language models (PLMs) exhibit limitations in accessing and precisely manipulating factual knowledge, leading to suboptimal performance on knowledge-intensive tasks, difficulty in expanding or revising their internal knowledge, lack of provenance for predictions, and a tendency to hallucinate.","Knowledge-intensive Natural Language Processing (NLP) tasks (e.g., Open-domain Question Answering, Fact Verification, abstractive text generation) where AI models need to generate factual, specific, and diverse language, or require access to up-to-date and verifiable external knowledge. This pattern is applicable when using pretrained parametric memory models (like seq2seq transformers) that need to be augmented with external, dynamically revisable, and inspectable knowledge.","Combine a pretrained parametric memory (a seq2seq model, e.g., BART) with an explicit, non-parametric memory (a dense vector index of text documents, e.g., Wikipedia). A pretrained neural retriever (e.g., DPR) is used to access this non-parametric memory by retrieving top-K relevant documents based on the input query. The retrieved documents are then provided as additional context to the seq2seq generator. The entire system (retriever and generator) is fine-tuned end-to-end, treating the retrieved documents as latent variables and marginalizing over their probabilities during training and inference.","Achieves state-of-the-art performance on a wide range of knowledge-intensive NLP tasks. Generates more specific, diverse, and factual language, and reduces hallucinations compared to parametric-only baselines. Enables easy expansion and revision of the model's knowledge and provides a form of interpretability by allowing inspection of the accessed knowledge. Facilitates unconstrained generation, outperforming extractive approaches even for extractive tasks.","['RAGSequence', 'RAGToken', 'Index Hotswapping']","['Open-domain Question Answering (NQ, TriviaQA, WebQuestions, CuratedTrec)', 'Abstractive Question Answering (MSMARCO NLG)', 'Jeopardy Question Generation', 'Fact Verification (FEVER)']",21,"['Generative AI', 'Knowledge & Reasoning', 'LLM-specific']"
RAGSequence,"Ensuring consistency and coherence in generated sequences when leveraging retrieved knowledge, particularly when the entire output is expected to be derived from a single, dominant source or consistent context.","Retrieval-Augmented Generation (RAG) tasks where the generated output sequence is best supported by a single, consistent retrieved document. The model needs to make a global decision about which document to use for the entire generation process.","Within the Retrieval-Augmented Generation (RAG) framework, the model treats the retrieved document as a single latent variable responsible for generating the complete output sequence. It marginalizes over the top-K retrieved documents, calculating the probability of the entire sequence given each document, and then summing these probabilities weighted by the document retrieval probability.","Produces coherent and consistent output sequences based on a single, globally chosen document. Effective for tasks where a single document provides sufficient context for the whole output.","['Retrieval-Augmented Generation (RAG)', 'RAGToken']","['Open-domain Question Answering', 'Abstractive Question Answering', 'Fact Verification']",30,"['Generative AI', 'LLM-specific']"
RAGToken,Generating output sequences that require combining information from multiple distinct retrieved documents or dynamically switching context across different parts of the generated text to provide a comprehensive and diverse answer.,Retrieval-Augmented Generation (RAG) tasks where different tokens or segments of the output sequence might be best supported by different pieces of retrieved knowledge. This is particularly useful for complex generations that synthesize information from various sources.,"Within the Retrieval-Augmented Generation (RAG) framework, the model allows for drawing a potentially different latent document for each target token to be generated. It marginalizes over the top-K retrieved documents at each generation step, calculating the probability of the next token given each document, and then summing these probabilities. This enables the generator to dynamically choose content from several documents as it produces the answer token by token.","Generates responses that can combine content from multiple documents, leading to more diverse and factually rich outputs, especially for tasks requiring synthesis of information. Improves performance on tasks that benefit from dynamic context switching.","['Retrieval-Augmented Generation (RAG)', 'RAGSequence']","['Jeopardy Question Generation (where questions often combine two separate pieces of information)', 'Open-domain Question Answering', 'Abstractive Question Answering', 'Fact Verification']",30,"['Generative AI', 'LLM-specific']"
Index Hotswapping (Dynamic Knowledge Update),"Parametric-only language models suffer from 'stale knowledge' and cannot easily update their world knowledge as new information emerges without computationally expensive and time-consuming full model retraining. This limits their applicability in dynamic, knowledge-intensive environments.","AI systems, particularly those using large language models, that require up-to-date external knowledge and need to adapt to changing factual landscapes. This pattern is applicable when the core model architecture is designed with a separable, non-parametric memory component.","Employ a Retrieval-Augmented Generation (RAG) architecture where factual knowledge is stored in an external, non-parametric memory (a document index). To update the model's world knowledge, simply replace or update this external document index at test time. The parametric components of the model (e.g., the generator and query encoder) remain fixed and do not require retraining.","Enables dynamic and efficient updating of the model's world knowledge. The model can accurately respond to queries based on the most current information available in the swapped index. Dramatically reduces the need for continuous, costly retraining of large language models to stay current with real-world changes.",['Retrieval-Augmented Generation (RAG)'],"['Any knowledge-intensive NLP task requiring current information, such as factual question answering, news summarization, or policy compliance checks where external knowledge evolves rapidly.']",21,"['MLOps', 'Knowledge & Reasoning']"
Prompt Chaining / Multi-Step Prompting,"Single LLM calls are often insufficient for complex tasks requiring iterative refinement, multi-step reasoning, or interaction.",Tasks that can be broken down into a sequence of dependent sub-tasks or require intermediate steps of reasoning and/or action.,"Decompose a complex task into a sequence of smaller steps, where the output of one LLM call (or external action) informs the next prompt. This can involve using the LLM itself for preprocessing, eliciting reasoning, or generating intermediate steps.","Enables more complex algorithms and behaviors from LLMs, allowing for structured, multi-stage problem-solving.","['Self-Critique / Self-Refinement', 'ReAct (Reasoning and Acting)', 'Reasoning Actions', 'Decision Making (Planning & Execution)', 'Tree of Thoughts (ToT) / Deliberative Search-Based Planning']","Complex question answering, interactive agents, code generation, planning",41,
Retrieval Augmented Generation (RAG),"LLMs have limited knowledge (knowledge cutoff, factual inaccuracies) and struggle with domain-specific, private, or real-time information.","Tasks requiring access to up-to-date, specific, or external knowledge not present in the LLM's training data, or to ground responses in verifiable sources.","Augment the LLM's input prompt with relevant information retrieved from an external knowledge source (e.g., vector database, document store, web search, API). This retrieved context guides the LLM's generation.","Improves factual accuracy, reduces hallucinations, provides transparency, and grounds the LLM to specific, external information.","['Modular Memory System', 'Reasoning Actions']","Knowledge-intensive NLP tasks, question answering, data-driven intelligence, agents requiring external information",18,
Self-Critique / Self-Refinement,"LLM outputs may contain errors, biases, or suboptimal solutions, and a single generation might not be sufficient.","Tasks where quality control, error detection, and iterative improvement of LLM-generated content are crucial, or where multiple attempts can lead to a better solution.","Use the LLM itself (or another model) to evaluate its own previous output, identify flaws, and generate revised outputs or critiques. This often involves feeding the initial output and a critique/feedback back into the LLM as part of a new prompt, or generating multiple options and selecting the best.","Improves the quality, accuracy, and safety of LLM outputs by allowing for iterative correction and optimization.","['Prompt Chaining / Multi-Step Prompting', 'Reasoning Actions', 'Learning Actions', 'Memory-Augmented Reflection']","Code generation, complex problem-solving, dialogue systems, safety alignment, creative tasks",23,
Agentic Loop / Cognitive Loop / Decision-Making Loop,"LLMs are inherently stateless and passive, making them unsuitable for autonomous, adaptive behavior in dynamic, interactive environments.","Building intelligent agents that need to operate continuously, interact with external environments (physical, digital, human), maintain internal state, and pursue long-term goals.","Implement a continuous feedback loop where the agent iteratively performs the following steps: 1. Observe (perceive the environment, often grounded to text). 2. Plan (use internal processes like reasoning and retrieval from memory to decide on the next action). 3. Act (execute the chosen action, internal or external). 4. Learn (update internal memory or parameters based on the action's outcome or new experiences).","Transforms stateless LLMs into stateful, adaptive, and autonomous agents capable of sustained interaction and goal-directed behavior.","['Modular Memory System', 'Grounding Actions / Tool Use', 'Reasoning Actions', 'Learning Actions', 'Decision Making (Planning & Execution)', 'ReAct (Reasoning and Acting)']","Robotics, web agents, game AI, social simulations, long-running conversational agents",16,
Modular Memory System,"LLMs have limited context windows and are stateless, making it challenging to retain long-term information, track dialogue history, or store agent-specific knowledge and experiences.","Agents requiring persistence of information across interactions, access to past experiences, domain-specific knowledge, or the ability to learn and update internal state.","Design the agent with distinct, specialized memory modules, each optimized for different types of information and access patterns. These include: Working Memory (active, short-term), Episodic Memory (past experiences), Semantic Memory (general knowledge/facts), and Procedural Memory (agent's code, LLM weights, skills). Information is dynamically moved between these memories and working memory via retrieval and learning actions.","Overcomes LLM statelessness and context window limitations, enabling long-term memory, learning, more sophisticated reasoning, and a richer internal state for the agent.","['Retrieval Augmented Generation (RAG)', 'Learning Actions', 'Memory-Augmented Reflection']","Long-running dialogue agents, embodied agents, lifelong learning systems, personalized agents",26,
Grounding Actions / Tool Use,"LLMs operate on text and are isolated from the real world or specific digital tools, limiting their ability to perceive non-textual inputs or perform concrete actions.","Agents designed to operate in physical robots, interact with digital interfaces (APIs, websites, games), or engage in human dialogue, requiring interaction beyond pure text generation.","Implement specific procedures (tools, APIs, or direct code execution) that translate non-textual perceptual inputs (vision, audio, sensor data) into textual observations for the LLM, and translate LLM-generated textual commands or structured function calls into executable actions in the environment (e.g., motor commands, API calls, web interactions, natural language responses).","Enables LLMs to perceive and act in the external world, connecting their linguistic and reasoning abilities to real-world effects, expanding their capabilities beyond text generation.","['Agentic Loop / Cognitive Loop / Decision-Making Loop', 'Function Calling / Structured Output Parsing', 'ReAct (Reasoning and Acting)', 'LLM-Code Hybrid / Complementary Capabilities']","Robotics, web automation, API integration, game playing, conversational AI, data querying",24,
Reasoning Actions,"LLMs often generate direct answers or actions without explicit intermediate thought processes, which can lead to suboptimal or incorrect outputs for complex tasks.","Tasks requiring deeper analysis, summarization, distillation of observations, inference from retrieved knowledge, or the generation of intermediate steps before a final action or answer.","Design specific internal actions where the LLM is prompted to process and synthesize information within its working memory (e.g., recent observations, retrieved facts) to generate new, temporary insights, analyses, or intermediate steps. This output is then written back into working memory, informing subsequent decisions.","Enables more deliberate, robust, and interpretable thought processes, leading to better-informed actions and improved problem-solving.","['Prompt Chaining / Multi-Step Prompting', 'Self-Critique / Self-Refinement', 'Decision Making (Planning & Execution)', 'Tree of Thoughts (ToT) / Deliberative Search-Based Planning', 'Memory-Augmented Reflection', 'ReAct (Reasoning and Acting)']","Planning, self-reflection, summarization, complex problem-solving, generating Chain-of-Thought",41,
