Pattern Name,Problem,Context,Solution,Result,Related Patterns,Uses,Cluster Number,Category
Interactive Retrieval,"Initial retrieval attempts might not provide sufficient or relevant context, leading to incomplete or incorrect LLM responses, and the system needs a mechanism to request more information.",Retrieval-augmented systems where the LLM needs to signal when more context is required to answer a question or complete a task.,"The LLM-based assistant is instructed to reply with a specific phrase (e.g., 'UPDATE CONTEXT') if it cannot find information in the current context. This triggers the user proxy agent to retrieve more relevant chunks and update the context for the assistant, initiating further retrieval attempts.","Improves performance on QA tasks, enables more robust retrieval augmentation, reduces 'I don't know' responses when information is available but not initially retrieved, and allows for dynamic context updates.","['Retrieval Augmentation', 'Human-in-the-Loop Agent']",Question-answering,0,
LLM as a Planner (with Executor),"Embodied agents or systems need to decompose high-level goals into actionable steps and execute them in an environment, often requiring iterative planning and feedback.","Interactive decision-making tasks in simulated or real-world environments (e.g., ALFWorld, MiniWoB) where an agent needs to generate and execute a sequence of actions.","An LLM-backed assistant agent generates plans and action decisions (e.g., using ReAct prompting), which are then executed by a separate executor agent. The executor agent interacts with the environment, performs actions, and reports results/observations as feedback back to the assistant.","Enables LLMs to tackle complex, multi-step tasks in interactive environments, facilitates task decomposition and execution, and allows for iterative refinement of plans based on environmental feedback.","['Tool-Augmented Agent', 'Grounding Agent']","ALFWorld (household environments), MiniWoB (web interaction tasks)",0,
Grounding Agent,"LLM-based agents may lack commonsense knowledge, struggle with physical world constraints, or get stuck in repetitive errors, especially in interactive or rule-bound environments.","Decision-making tasks where agents need to adhere to physical laws, game rules, or commonsense knowledge to avoid flawed plans or error loops.","Introduce a specialized agent that supplies crucial commonsense knowledge or rule reminders to the decision-making agent, particularly when early signs of recurring errors are detected or at the start of a task.","Significantly enhances the system's ability to avoid error loops, improves adherence to rules and commonsense, boosts task success rate, and provides a modular way to inject external knowledge.","['LLM as a Planner (with Executor)', 'Game-Playing Agent (with Rule Enforcement)']","ALFWorld (commonsense knowledge), Conversational Chess (game rules)",0,
Multi-Agent Coordination (Commander-Subordinate),"Orchestrating complex workflows involving multiple specialized agents to achieve a common goal, managing communication flow, and maintaining context/memory across interactions.","Applications requiring a division of labor among agents, where one agent oversees and directs others, and user interactions need to be managed (e.g., supply chain optimization).","Design a 'Commander' agent responsible for receiving user questions, coordinating with specialized 'subordinate' agents (e.g., Writer, Safeguard), directing communication flow, and handling memory tied to user interactions. The Commander executes code and requests interpretation.","Streamlined complex workflows, improved productivity, effective division of labor, context-aware decision-making, and reduced manual intervention.","['Role-Based Agent Specialization', 'Adversarial Agent Interaction', 'Multi-Agent Conversation']",Supply chain optimization (OptiGuide),0,
Role-Based Agent Specialization,"Complex tasks benefit from dividing responsibilities among agents with distinct expertise, improving efficiency and focus.","Multi-agent systems where different aspects of a task (e.g., code generation, safety checking, interpretation) can be handled by dedicated agents.","Assign specific roles and responsibilities to individual agents (e.g., Writer for crafting code and interpretation, Safeguard for checking code safety), allowing them to focus on their area of expertise and contribute to a larger workflow.","Improved performance, modularity, reduced code complexity, better handling of specialized sub-tasks, and clear accountability for different parts of the workflow.","['Multi-Agent Coordination (Commander-Subordinate)', 'Adversarial Agent Interaction']","Supply chain optimization (Writer, Safeguard agents)",0,
Adversarial Agent Interaction,"Ensuring quality, safety, or correctness of outputs by having agents critically evaluate each other's work, preventing errors or malicious actions.","Tasks where generated outputs (e.g., code, plans) need to be validated against specific criteria, security concerns, or potential risks before execution or finalization.","Design an agent (e.g., Safeguard) to act as a 'virtual adversarial checker,' critically screening the outputs of other agents (e.g., generated code) and raising issues if criteria are not met (e.g., security red flags, execution failures).","Improved safety, quality assurance, prevention of errors or malicious outputs, and a robust validation mechanism within the multi-agent system.","['Role-Based Agent Specialization', 'Multi-Agent Coordination (Commander-Subordinate)']",Supply chain optimization (Safeguard checking code safety),2,
Game-Playing Agent (with Rule Enforcement),"Developing interactive game applications where agents (human or AI) play by specific rules, and moves need validation to maintain game integrity.","Conversational games (e.g., chess) where players communicate in natural language, and a system needs to parse moves, apply game rules, and provide feedback.","Implement player agents (human or LLM-powered) and a separate 'board agent' that acts as a third party. The board agent provides game information, parses natural language moves into structured formats (e.g., UCI), validates moves against standard rules, and responds with errors if moves are illegal, prompting players to re-propose.","Natural, flexible, and engaging game dynamics; maintained game integrity; reduced hallucination of invalid moves by player agents; simplified development through modular design.","['Grounding Agent', 'Human-in-the-Loop Agent', 'Customizable Conversable Agent']",Conversational Chess,0,
Inner Monologue (via Nested Chat),"An agent needs to perform internal reasoning, self-reflection, or complex sub-computations without directly exposing these steps to the main conversation, mimicking human thought processes.",Enhancing an agent's reasoning and problem-solving capabilities by allowing it to 'think aloud' or consult internal sub-agents for complex decisions or critiques.,"Utilize the Nested Chat pattern where one agent holds the current conversation while invoking conversations with other agents as its 'inner monologue' to accomplish sub-tasks, reflect, or generate critiques, before formulating and sending its reply to the original sender.","Realizes self-reflection, improves LLM reasoning and problem-solving capability, allows for more complex internal processing and decision-making, and aligns with the 'Society of Mind' concept.",['Nested Chat'],"Self-reflection, complex internal reasoning, critique generation",0,
Role-Play Prompting,"Guiding LLM-backed agents to adopt specific personas or behaviors for effective collaboration, task execution, or dynamic interaction management.","Multi-agent conversations where agents need to adhere to defined roles (e.g., Assistant, Critic, Engineer) or for dynamic speaker selection in group chats to ensure appropriate contributions.","Incorporate natural language instructions in the agent's system message or prompts to explicitly define its role, responsibilities, and expected behavior within the conversation.","Agents exhibit consistent and appropriate behavior for their assigned roles, improves collaboration, enhances dynamic speaker selection, and leads to more effective consideration of conversation context and role alignment.","['Customizable Conversable Agent', 'Group Chat', 'Hybrid Control (Natural Language & Code)']","AssistantAgent system message, dynamic speaker selection in group chat",0,
Grounding Prompting,"Ensuring LLM outputs adhere to specific constraints, facts, or external information, and preventing hallucinations or irrelevant responses.","LLM-backed agents generating code, making decisions, or providing information where accuracy, adherence to rules, or specific output formats are critical.","Include natural language instructions in the prompt (e.g., system message) to guide the LLM to confine its outputs, verify answers, include verifiable evidence, or adhere to specific formats, making it easier for other agents to consume.","Reduces hallucinations, improves factual accuracy, ensures outputs are consumable by other agents or systems, and helps maintain consistency and reliability.","['Hybrid Control (Natural Language & Code)', 'Customizable Conversable Agent']","AssistantAgent system message (e.g., 'confine LLM outputs,' 'include verifiable evidence'), guiding agents to make legal moves in games (though a dedicated agent is often more robust)",0,
Retrieval-Augmented Generation (RAG),"Large Language Models (LLMs) often generate factually incorrect answers (hallucinations) and their knowledge is limited to their parametric memory, which can become outdated.","Enhancing the accuracy and factual consistency of LLM responses, particularly in knowledge-intensive tasks like Question Answering (QA).","Integrate non-parametric knowledge from external knowledge bases into LLMs. An additional retrieval module accesses a knowledge base to find information relevant to the given input, and this retrieved information is then incorporated into the LLM's input for generation.","Improves response accuracy, reduces hallucinations, and keeps LLMs current with world knowledge by providing supplementary context.","['Single-step RAG', 'Multi-step RAG', 'Adaptive Retrieval-Augmented Generation (AdaptiveRAG)']","['Question Answering (QA)', 'Fact-checking', 'Information synthesis']",0,
Single-step RAG,"LLMs may struggle with queries that require external knowledge beyond their internal parametric memory, but which can be resolved with a single, direct information lookup.","Question Answering tasks where queries are of moderate complexity, requiring external knowledge but not extensive multi-hop reasoning or iterative information gathering.","A retrieval model first identifies and retrieves relevant documents from an external knowledge source based on the input query. This retrieved information is then directly augmented into the LLM's input, allowing the LLM to generate an answer in a single retrieval-and-generation pass.","Offers significant improvements in accuracy for queries requiring external knowledge compared to non-retrieval methods, while maintaining relative efficiency for simpler queries.","['Retrieval-Augmented Generation (RAG)', 'Adaptive Retrieval-Augmented Generation (AdaptiveRAG)']","['Open-domain QA for moderate complexity queries', 'Information extraction from a single document']",0,
Multi-step RAG,"Complex queries necessitate synthesizing information from multiple source documents and performing multi-hop reasoning, which cannot be adequately addressed by a single retrieval-and-response step.",Multi-hop Question Answering (QA) and other complex reasoning tasks where answers depend on interconnected pieces of information spread across several documents.,"The LLM interacts iteratively with a retrieval module over several rounds. In each step, new documents are retrieved based on the current query and accumulated context (including previous documents and intermediate answers). This iterative process allows the LLM to progressively refine its understanding and build a comprehensive foundation to formulate a final answer. This can involve query decomposition or interleaving Chain-of-Thought reasoning with retrieval.","Effectively handles complex multi-hop queries and multi-reasoning tasks, providing more comprehensive and accurate answers for challenging questions.","['Retrieval-Augmented Generation (RAG)', 'Chain-of-Thought Reasoning', 'Adaptive Retrieval-Augmented Generation (AdaptiveRAG)']","['Multi-hop QA', 'Complex reasoning tasks', 'Iterative information synthesis']",0,
Adaptive Retrieval-Augmented Generation (AdaptiveRAG),"Existing one-size-fits-all Retrieval-Augmented Generation (RAG) approaches are inefficient for simple queries (e.g., using multi-step RAG for a straightforward question) and insufficient for complex queries (e.g., using single-step RAG for a multi-hop question). Real-world user queries exhibit a wide range of complexities.","Question Answering systems built with RAG, where the system needs to dynamically balance computational efficiency and response accuracy across diverse query complexities.","Implement a framework that dynamically selects the most suitable RAG strategy (non-retrieval, Single-step RAG, or Multi-step RAG) for an incoming query. This selection is driven by a 'Query Complexity Classifier' (a smaller Language Model) that predicts the complexity level of the query. The system adapts its operational behavior without changing internal model architecture or parameters during adaptation.","Significantly enhances the overall efficiency and accuracy of QA systems by allocating appropriate computational resources based on query complexity, providing a robust middle ground between minimalist and maximalist approaches.","['Retrieval-Augmented Generation (RAG)', 'Single-step RAG', 'Multi-step RAG', 'Query Complexity Classifier']","['Open-domain Question Answering', 'Dynamic resource management in LLM applications', 'Personalized information retrieval']",0,
Query Complexity Classifier,"To enable dynamic adaptation of LLM strategies (e.g., in RAG systems), the system needs to accurately determine the complexity level of an incoming user query. However, pre-annotated datasets for query-complexity pairs are typically unavailable.","As a component within an adaptive LLM framework (like AdaptiveRAG), where different processing strategies are optimal for different query complexities.","Train a smaller Language Model (Classifier) to predict one of several predefined complexity levels (e.g., straightforward, moderate, complex) for a given query. The training dataset for this classifier is automatically constructed using two strategies: 1) **Outcome-based Labeling:** Assign labels based on which LLM strategy (e.g., non-retrieval, single-step RAG, multi-step RAG) successfully answers the query, prioritizing simpler successful strategies. 2) **Inductive Bias Labeling:** For queries not covered by outcome-based labeling, leverage inherent biases in existing datasets (e.g., single-hop datasets for moderate, multi-hop datasets for complex queries).","Provides an effective mechanism for pre-determining query complexity, which is instrumental in dynamically selecting the most fitting LLM strategy, thereby improving overall system efficiency and accuracy.",['Adaptive Retrieval-Augmented Generation (AdaptiveRAG)'],"['Dynamic strategy selection in LLM applications', 'Query routing', 'Resource optimization in AI systems']",0,
Chain-of-Thought Reasoning,"Large Language Models (LLMs) often struggle with complex reasoning tasks, providing direct answers that may be incorrect or lack transparency, especially for multi-step problems.","Improving the reasoning capabilities and explainability of LLMs, particularly when they need to perform multi-step logical deductions or interact with external tools/modules iteratively.","Instead of directly asking for the final answer, prompt the LLM to generate a sequence of intermediate thoughts, steps, or justifications before arriving at the final conclusion. This 'chain of thought' guides the LLM through a logical progression of reasoning.","Elicits emergent reasoning abilities in LLMs, leading to improved performance on complex tasks, better explainability of the LLM's decision-making process, and enhanced capability for multi-step problem-solving.",['Multi-step RAG'],"['Multi-hop Question Answering', 'Complex problem-solving', 'Agentic AI planning', 'Mathematical reasoning']",0,
Interpretable Global Surrogate Model,"Complex, black-box AI models lack global interpretability, making it hard to understand their overall decision logic.","When a high-performing but opaque AI model is used, and there's a need for a holistic understanding of its behavior across the entire dataset.","Train a simpler, inherently interpretable model (the 'surrogate') on the predictions of the complex black-box model. This surrogate aims to mimic the global behavior of the black-box model.","A more transparent, understandable model that approximates the global decision-making of the original black-box system.",[],"Global model understanding, model validation, debugging.",3,
Local Surrogate Explanation (LIME-like),Understanding why a black-box AI model made a specific individual prediction is difficult due to its opacity.,"When individual predictions of a black-box model need to be explained in a human-understandable way, focusing on the local factors influencing that specific decision.","For a given instance, generate perturbed samples in its local neighborhood. Train a simple, interpretable model (e.g., linear model) on these perturbed samples, weighted by their proximity to the instance, to locally approximate the black-box model's behavior.",A feature importance vector indicating which features locally contributed to the individual prediction.,"['Interpretable Global Surrogate Model', 'Game-Theoretic Feature Attribution (SHAP-like)', 'Local Rule-Based Explanation (Anchor/LORE-like)', 'LACE (Local Pattern-Based Explanation with Prediction Difference)']","Local prediction explanation, debugging individual decisions, building trust.",3,
Game-Theoretic Feature Attribution (SHAP-like),"Quantifying the contribution of each feature to an individual black-box model's prediction in a fair, consistent, and theoretically sound manner.","When a quantitative, fair, and consistent attribution of feature importance is required for individual predictions of black-box models, often for fairness analysis or detailed debugging.","Apply concepts from cooperative game theory, specifically Shapley values, to attribute the prediction outcome to each input feature. This involves calculating the marginal contribution of each feature across all possible coalitions of features.","A set of Shapley values, one for each feature, representing its average marginal contribution to the prediction.","['Local Surrogate Explanation (LIME-like)', 'LACE (Local Pattern-Based Explanation with Prediction Difference)', 'Subgroup Divergence Analysis (DivExplorer Algorithm)']","Local prediction explanation, fairness analysis, bias detection, quantitative debugging.",3,
Local Rule-Based Explanation (Anchor/LORE-like),"Providing human-understandable, qualitative explanations for individual black-box model predictions in a rule-based format.","When users prefer rule-based explanations for individual predictions, which can be easier to interpret than feature importance scores, especially for structured data.","Extract a set of local rules (e.g., 'anchors' or decision rules from a local surrogate tree) that describe the conditions under which the black-box model makes a specific prediction in the neighborhood of the instance.","A set of IF-THEN rules that explain the individual prediction, providing qualitative insights into the decision logic.","['Local Surrogate Explanation (LIME-like)', 'LACE (Local Pattern-Based Explanation with Prediction Difference)']","Local prediction explanation, qualitative debugging, human-in-the-loop validation.",3,
Counterfactual Explanation,Understanding what minimal changes to an input instance would cause a black-box AI model to change its prediction.,"When users need actionable insights into how to alter an input to achieve a desired outcome from a black-box model, or to understand the model's decision boundaries.","Find the closest possible instance to the original input (in terms of feature values) that results in a different, desired prediction from the black-box model.",A 'what-if' scenario showing the smallest perturbation to an input that flips the model's decision.,[],"Actionable explanations, fairness analysis (e.g., how to change an outcome), debugging, understanding model sensitivity.",3,
LACE (Local Pattern-Based Explanation with Prediction Difference),"Explaining individual black-box classifier predictions by highlighting both individual and interacting feature contributions qualitatively (rules) and quantitatively (prediction difference), while addressing computational complexity.","Structured data, black-box classification models, need for model-agnostic, local, and comprehensive explanations (qualitative and quantitative).","Captures locality via K-nearest neighbors, trains an associative classifier (e.g., L3) on these labeled neighbors to derive local rules (patterns), estimates prediction difference for individual attribute values and relevant patterns (from rules) via marginalization, and automatically tunes K based on locality approximation.","A qualitative explanation (local rules/patterns) and a quantitative explanation (prediction difference for individual features and patterns), visualized as a bar plot.","['Local Surrogate Explanation (LIME-like)', 'Game-Theoretic Feature Attribution (SHAP-like)', 'Local Rule-Based Explanation (Anchor/LORE-like)', 'Interactive Human-in-the-Loop Explanation Tool (xPlain)']","XAI, debugging, model validation, human-in-the-loop inspection.",3,
Interactive Human-in-the-Loop Explanation Tool (xPlain),"Facilitating human understanding, debugging, and trust in black-box AI models through interactive exploration of individual predictions.","Black-box classification models, need for interactive XAI, model validation, debugging, and comparison.","Integrates a local explanation method (LACE) into an interactive UI, allowing users to inspect, compare, perform 'what-if' analysis, define custom rules, and view aggregated explanation metadata (attribute view, item view, local rule view).","Enhanced human understanding, trust, and ability to debug and compare AI models.",['LACE (Local Pattern-Based Explanation with Prediction Difference)'],"XAI, model validation, debugging, model comparison, ethical AI.",3,
Subgroup Divergence Analysis (DivExplorer Algorithm),"Identifying and characterizing data subgroups where a black-box classification model behaves differently (divergently) from its overall behavior, especially for fairness and error analysis.","Black-box classification models, structured data, need for model-agnostic subgroup analysis, fairness assessment, error analysis, and model debugging.","Defines a 'divergence' metric for itemsets, uses frequent pattern mining to extract all frequent itemsets, assesses statistical significance, quantifies item contributions to divergence using Shapley values, generalizes Shapley values for 'global item divergence', identifies 'corrective items', and prunes redundant itemsets.","Identification of critical data subgroups, characterization of their divergent behavior, insights into contributing factors (items), and detection of corrective items.","['Game-Theoretic Feature Attribution (SHAP-like)', 'Interactive Subgroup Divergence Exploration Tool (DivExplorer System)']","Model validation, testing, error analysis, fairness assessment, bias identification, responsible AI.",3,
Interactive Subgroup Divergence Exploration Tool (DivExplorer System),Enabling interactive exploration and inspection of divergent subgroups identified by the DivExplorer algorithm.,"Black-box classification models, need for interactive subgroup analysis, model debugging, and bias identification.","Integrates the DivExplorer algorithm into an interactive UI, allowing users to view/sort divergent itemsets, drill down into item contributions, visualize the itemset lattice, search for supersets, and examine global item influence.","Facilitates human understanding of subgroup-specific model behaviors, aids in debugging, and supports bias identification.",['Subgroup Divergence Analysis (DivExplorer Algorithm)'],"Model validation, debugging, fairness assessment, responsible AI.",3,
