Pattern Name,Problem,Context,Solution,Result,Related Patterns,Uses,Cluster Number,Category
Hierarchical Planning with LLMs,"Complex, long-horizon tasks are difficult for embodied agents to plan directly. Traditional hierarchical planners may lack the commonsense knowledge or few-shot learning capabilities of LLMs.","Embodied agents needing to execute multi-step instructions in complex, real-world-like environments.","Decompose the overall planning problem into a high-level planner and a low-level planner. The LLM serves as the high-level planner, generating a sequence of abstract subgoals (e.g., 'Navigation potato', 'Pickup potato'). A separate, specialized low-level planner then translates each subgoal into a sequence of primitive actions executable in the environment.","Improves planning efficiency and tractability for long-horizon tasks by leveraging LLMs' commonsense knowledge for high-level reasoning while delegating low-level execution details to a more specialized, efficient component. Makes low-level planning conditionally independent of the natural language instruction.","['LLM as a Generative Planner', 'Grounded Replanning']","['Embodied instruction following', 'Vision-and-language navigation', 'Robotics']",0,
Grounded Replanning,"LLM-generated plans, while plausible, often lack physical grounding to the current environment, leading to unexecutable actions, references to non-existent objects, or the agent getting stuck. Static plans cannot adapt to dynamic environmental changes or execution failures.","Embodied agents executing LLM-generated high-level plans in partially observable, dynamic environments where initial plans may become invalid or suboptimal.","Implement a closed-loop system where the LLM dynamically updates its high-level plan based on environmental feedback. When the agent encounters an issue (e.g., fails an action, takes too long to complete a subgoal), the LLM is re-prompted. This re-prompt includes a description of the current environment (e.g., a list of observed objects from a vision model) and the partial plan already completed. The LLM then generates a new, grounded continuation of the plan. Logit biases can be used to prioritize observed objects.","Enables LLMs to dynamically adapt plans to the current physical reality, overcoming execution failures, producing more robust and physically grounded plans, and improving task completion rates in diverse environments.","['LLM as a Generative Planner', 'Hierarchical Planning with LLMs', 'Prompt Design for LLM Planning']","['Adaptive planning for embodied agents', 'Robust execution in dynamic environments', 'Real-time plan correction']",0,
Prompt Design for LLM Planning,"Unleashing the full potential of LLMs for planning requires careful guidance, as their output quality is highly sensitive to prompt structure, example selection, and output constraints. Achieving few-shot learning and grounding requires specific prompt engineering.","Adapting pre-trained LLMs to generate structured, executable high-level plans for embodied agents with minimal task-specific data and ensuring physical grounding.","Systematically design the LLM prompt to include: 
1.  **Task Explanation:** An intuitive description of the task and allowed high-level actions. 
2.  **In-context Examples:** A small number of exemplar instruction-high-level plan pairs to demonstrate the desired planning behavior (in-context learning). 
3.  **Dynamic Example Retrieval:** For each test case, dynamically select the most relevant in-context examples using a similarity metric (e.g., k-NN on instruction embeddings). 
4.  **Output Constraints/Biases:** Apply logit biases to favor allowable actions and objects, and especially objects observed in the current environment, to guide the LLM towards valid and grounded plans. 
5.  **Contextual Information:** For replanning, include completed subgoals and a list of currently observed objects.","Enables effective few-shot planning, improves the quality and relevance of generated plans, constrains LLM output to valid actions and objects, and facilitates dynamic adaptation and grounding.","['LLM as a Generative Planner', 'Grounded Replanning']","['Few-shot learning for LLM-based agents', 'Guiding LLMs for structured output', 'Improving plan quality and executability', 'Enhancing physical grounding']",0,
Retrieval-Augmented Generation (RAG),"Large pretrained language models (LLMs) exhibit limitations in knowledge-intensive tasks, including: 1) difficulty in accessing and precisely manipulating factual knowledge stored implicitly in their parameters, 2) a tendency to hallucinate or generate factually incorrect information, 3) lack of provenance or explainability for their predictions, 4) inability to easily expand or revise their world knowledge without costly retraining, and 5) lagging performance compared to task-specific architectures on knowledge-intensive tasks.","Designing AI systems for knowledge-intensive Natural Language Processing (NLP) tasks such as open-domain question answering, abstractive summarization, fact verification, and complex text generation. This pattern is applicable when factual accuracy, up-to-date information, and interpretability are critical, and when leveraging large pretrained language models while needing to overcome their inherent limitations regarding external, dynamic knowledge.","Combine a pretrained *parametric memory* (a seq2seq language model, e.g., BART) with an *explicit nonparametric memory* (a dense vector index of external knowledge, e.g., Wikipedia). A pretrained neural retriever (e.g., Dense Passage Retriever - DPR) is used to dynamically access relevant information from the nonparametric memory based on the input query. The retriever converts the input into a dense vector and performs Maximum Inner Product Search (MIPS) against the document index. The generator model then conditions its output on both the original input sequence and the retrieved documents. The entire system is finetuned end-to-end, treating the retrieved documents as latent variables. The document encoder and index can be kept fixed during finetuning for efficiency, while the query encoder and generator are updated. Two main approaches for marginalizing over retrieved documents are: 
1. **RAG-Sequence:** The model uses the same retrieved document to generate the complete output sequence, marginalizing over the top-K retrieved documents to compute the sequence probability.
2. **RAG-Token:** The model can draw a different latent document for each target token during generation, allowing it to combine information from multiple documents. 
The nonparametric memory is designed to be human-readable (raw text) and human-writable, facilitating interpretability and dynamic updates.","1) **Improved Factual Accuracy & Reduced Hallucinations:** Generates more factual, specific, and diverse language, significantly reducing hallucinations compared to parametric-only models. 
2) **State-of-the-Art Performance:** Achieves state-of-the-art results on various knowledge-intensive NLP tasks, including open-domain question answering. 
3) **Dynamic Knowledge Updates:** Enables easy and dynamic updating of the model's world knowledge by simply replacing or editing the nonparametric memory (index hotswapping) without requiring costly retraining of the parametric model. 
4) **Enhanced Interpretability:** The explicit nature of the nonparametric memory (raw text documents) allows for inspection of the accessed knowledge, providing a form of interpretability. 
5) **Flexibility:** Combines the generation flexibility of closed-book models with the performance of open-book retrieval-based approaches. 
6) **Unified Architecture:** Provides a general-purpose finetuning recipe applicable across a wide range of seq2seq tasks.",[],"['Open-domain Question Answering (QA)', 'Abstractive Question Answering', 'Jeopardy Question Generation', 'Fact Verification', 'General knowledge-intensive Natural Language Processing (NLP) tasks']",0,
Cognitive Architecture for Language Agents (CoALA),"Lack of a unified framework to organize existing language agents and guide future development, leading to custom terminology and difficulty comparing agents.","Designing general-purpose language agents that interact with internal state and external environments, leveraging Large Language Models (LLMs) as a core component.","Structure language agents with modular memory components (working, episodic, semantic, procedural), a structured action space (grounding, retrieval, reasoning, learning), and a generalized decision-making process (planning, execution loop). This framework positions the LLM as the central computational unit.","Provides a conceptual framework for characterizing and designing agents, organizes diverse empirical work, and identifies future directions for developing more capable and human-like agents.","['Working Memory for LLM Agents', 'Episodic Memory for LLM Agents', 'Semantic Memory for LLM Agents', 'Procedural Memory for LLM Agents', 'Grounding Actions', 'Retrieval Augmented Generation (RAG) for Agents', 'LLM-based Reasoning', 'Agent Self-Improvement (Learning Actions)', 'Deliberative Decision Making (Planning with LLMs)']","Organizing, designing, and comparing language agents; guiding the development of new LLM-based agents.",0,
Working Memory for LLM Agents,Large Language Models (LLMs) are stateless; information needs to persist across calls and be readily available for the current decision cycle to enable multi-step interactions.,"Language agents engaged in multi-step interactions with environments or users, needing to track current circumstances, active goals, perceptual inputs, and intermediate reasoning results.","Maintain an explicit data structure (working memory) that persists across LLM calls. LLM input is synthesized from a subset of working memory (e.g., a prompt template and relevant variables), and LLM output is parsed back into working memory variables (e.g., action names and arguments).","Enables statefulness for LLM agents, allows the LLM to operate on a consistent and updated context, and serves as a central hub connecting different agent components (long-term memories, grounding interfaces).","['Cognitive Architecture for Language Agents (CoALA)', 'LLM-based Reasoning', 'Deliberative Decision Making (Planning with LLMs)']","Tracking dialogue state, active knowledge, perceptual inputs, goals, intermediate reasoning steps in language agents.",0,
Episodic Memory for LLM Agents,Language agents need to learn from past experiences and retrieve relevant events to inform future decision-making and adapt their behavior over time.,"Agents interacting over multiple episodes (e.g., game trajectories, conversational turns, task executions), requiring the ability to reflect on past behaviors or use prior experiences as examples.","Store experience from earlier decision cycles (e.g., training input-output pairs, history event flows, game trajectories) in a dedicated episodic memory module. During the planning stage of a decision cycle, relevant episodes can be retrieved into working memory to support reasoning.","Supports reasoning by providing concrete examples, enables learning from experience, and allows agents to adapt their behavior based on their history.","['Cognitive Architecture for Language Agents (CoALA)', 'Retrieval Augmented Generation (RAG) for Agents', 'Agent Self-Improvement (Learning Actions)']","Reinforcement learning agents, Generative Agents (Park et al. 2023), Reflexion (Shinn et al. 2023) for reflecting on failed episodes.",0,
Semantic Memory for LLM Agents,"Language agents require access to explicit world knowledge and self-knowledge beyond what is implicitly stored in LLM weights, and the ability to incrementally build this knowledge from experience.","Tasks requiring external knowledge support, reasoning, or decision-making; agents needing to accumulate and store facts about the world or their operational domain.","Store an agent's knowledge about the world and itself (e.g., facts, game manuals, unstructured text, inferences) in a semantic memory module. This memory can be initialized from external databases (e.g., Wikipedia) or updated by LLM-based reasoning actions.","Provides explicit knowledge support, enhances reasoning capabilities, and allows for incremental knowledge building from experience, reducing reliance on the LLM's parametric memory for factual recall.","['Cognitive Architecture for Language Agents (CoALA)', 'Retrieval Augmented Generation (RAG) for Agents', 'Agent Self-Improvement (Learning Actions)', 'LLM-based Reasoning']","Retrieval-augmented NLP, reading to learn in reinforcement learning, Reflexion (Shinn et al. 2023) for storing inferences, Generative Agents (Park et al. 2023) for storing reflections.",0,
Procedural Memory for LLM Agents,"Language agents need to store and execute rules, skills, and decision-making logic, both implicitly (in LLM weights) and explicitly (as agent code), and to learn new procedures to adapt their capabilities.","Agents requiring specific behaviors, algorithms, or the ability to learn new skills; agents needing to adapt their 'source code' or operational logic.","Maintain two forms of procedural memory: implicit knowledge stored in LLM weights and explicit knowledge written in the agent's code. The explicit code includes procedures for actions (reasoning, retrieval, grounding, learning) and decision-making itself. These procedures can be retrieved and executed, and new ones can be learned and written to procedural memory.","Defines agent behavior, enables skill learning and reuse, allows for complex control flow, and supports self-modification of agent logic, leading to more adaptable and capable agents.","['Cognitive Architecture for Language Agents (CoALA)', 'Agent Self-Improvement (Learning Actions)', 'Grounding Actions', 'Retrieval Augmented Generation (RAG) for Agents']","Voyager (Wang et al. 2023a) for maintaining a library of code-based skills, Soar architecture for storing productions.",0,
Grounding Actions,"Large Language Models (LLMs) primarily operate on text, but agents need to interact with and perceive real-world (physical, digital, human dialogue) environments.","Agents deployed in physical robots, digital environments (e.g., games, APIs, websites), or engaging in dialogue with humans or other agents, requiring interaction beyond pure text generation.","Implement procedures that execute external actions in the environment and process environmental feedback into working memory as text. This often involves converting multimodal input (e.g., vision, audio) to text (e.g., via Vision-Language Models) and translating text commands into physical or digital actions.","Simplifies the agent's interaction with the outside world by abstracting it as a text-based interface, enables LLMs to control embodied agents, and allows interaction with diverse and complex environments.","['Cognitive Architecture for Language Agents (CoALA)', 'Working Memory for LLM Agents', 'Procedural Memory for LLM Agents']","Robotics (Ahn et al. 2022), web manipulation (Yao et al. 2022a), dialogue systems, game agents, API interaction (often packaged as 'tools').",0,
Retrieval Augmented Generation (RAG) for Agents,"Large Language Models (LLMs) have limited context windows and may lack specific, up-to-date, or domain-specific information needed for tasks, leading to hallucinations or incomplete responses.","Language agents needing to access and utilize information from their long-term memories (episodic, semantic, procedural) to inform current decisions, generate more accurate responses, or retrieve relevant skills.","Implement procedures to read relevant information from long-term memories into working memory, which then augments the LLM's input prompt. This can involve various retrieval methods such as rule-based, sparse (e.g., BM25), or dense (e.g., embedding-based) retrieval.","Augments the LLM's knowledge base, supports more informed reasoning and decision-making, enables efficient use of stored information, and reduces reliance on the LLM's parametric memory alone, improving factual accuracy and relevance.","['Cognitive Architecture for Language Agents (CoALA)', 'Episodic Memory for LLM Agents', 'Semantic Memory for LLM Agents', 'Procedural Memory for LLM Agents', 'LLM-based Reasoning']","Voyager (Wang et al. 2023a) for skill retrieval, Generative Agents (Park et al. 2023) for event retrieval, DocPrompting (Zhou et al. 2022a) for code generation, general knowledge-intensive NLP tasks.",0,
LLM-based Reasoning,"Agents need to process and generate new information from their current working memory to support learning or decision-making, beyond simple input-output mapping, especially for complex tasks.","Agents needing to summarize observations, distill insights, reflect on trajectories, or process retrieved information; tasks requiring intermediate thought steps, planning, or self-correction.","Use the Large Language Model (LLM) to process the contents of working memory and generate new information (e.g., analyses, plans, reflections, intermediate steps). This often involves specific prompting techniques (e.g., Chain-of-Thought, ReAct format) to elicit targeted reasoning steps, and the generated information can be written back to working memory or to long-term memory.","Generates new knowledge, supports learning, provides additional context for subsequent LLM calls, and enables more sophisticated decision-making and problem-solving capabilities for agents.","['Cognitive Architecture for Language Agents (CoALA)', 'Working Memory for LLM Agents', 'Prompt Engineering & Chaining', 'Agent Self-Improvement (Learning Actions)', 'Deliberative Decision Making (Planning with LLMs)']","ReAct (Yao et al. 2022b) for synergizing reasoning and acting, Reflexion (Shinn et al. 2023) for reflecting on failed episodes, Generative Agents (Park et al. 2023) for generating reflections, Tree of Thoughts (Yao et al. 2023) for deliberate problem solving.",0,
Agent Self-Improvement (Learning Actions),"Language agents need to continuously adapt and improve their capabilities over time based on new experiences and knowledge, beyond initial training or fixed programming.","Agents operating in dynamic environments, requiring lifelong learning, or needing to acquire new skills, knowledge, or modify their internal state or code to enhance performance.","Implement procedures to write information to long-term memory. This encompasses various forms of learning: updating episodic memory with experience, updating semantic memory with knowledge (e.g., inferences, reflections), updating LLM parameters (e.g., finetuning via supervised, imitation, reinforcement learning, human/AI feedback), and updating agent code (procedural memory) for reasoning (e.g., prompt templates), grounding (e.g., code-based skills), or retrieval procedures.","Enables lifelong learning, adaptation to new tasks and environments, acquisition of new skills and knowledge, and self-modification of agent behavior and logic, leading to more robust and autonomous agents.","['Cognitive Architecture for Language Agents (CoALA)', 'Episodic Memory for LLM Agents', 'Semantic Memory for LLM Agents', 'Procedural Memory for LLM Agents', 'LLM-based Reasoning', 'Deliberative Decision Making (Planning with LLMs)']","Reflexion (Shinn et al. 2023) for learning from failed episodes, Voyager (Wang et al. 2023a) for learning new code-based skills, Generative Agents (Park et al. 2023) for generating and storing reflections, finetuning LLMs for specific domains.",0,
Deliberative Decision Making (Planning with LLMs),"Agents need a structured and strategic way to choose which action (grounding, learning, reasoning, retrieval) to apply in a given situation, especially for complex, multi-step tasks where direct action generation is insufficient.","Agents facing multi-step problems, requiring planning, evaluation of alternatives, and selection of the best action; tasks where the consequences of actions need to be considered before execution.","Structure the top-level agent program into decision cycles, each involving a planning stage (propose, evaluate, and select candidate actions using LLM-based reasoning and retrieval) and an execution stage. This can involve iterative proposal and evaluation, and the use of search algorithms (e.g., tree search) to explore potential action sequences.","Enables agents to make more informed and strategic choices, supports complex planning, allows for iterative improvement of candidate solutions, and reduces the myopia of single-step action generation, leading to more robust and goal-oriented behavior.","['Cognitive Architecture for Language Agents (CoALA)', 'LLM-based Reasoning', 'Retrieval Augmented Generation (RAG) for Agents', 'Prompt Engineering & Chaining', 'Working Memory for LLM Agents']","Tree of Thoughts (Yao et al. 2023), RAP (Hao et al. 2023) for implementing BFS/DFS and MCTS with LLMs, SayCan (Ahn et al. 2022) for evaluating actions, ReAct (Yao et al. 2022b) for planning and remaking action plans.",0,
Prompt Engineering & Chaining,"Large Language Models (LLMs) are stateless and their output distribution needs to be biased towards high-quality, task-specific productions; single LLM calls are limited in complexity and multi-step reasoning.","Using LLMs for various tasks, including few-shot learning, question answering, and tasks requiring sequential reasoning, iterative refinement, or the execution of complex algorithms.","Manipulate the LLM's input string (prompt) to control its behavior. This involves preprocessing the input by concatenating additional text, selecting relevant examples, or eliciting targeted reasoning. For multi-step tasks, multiple LLM calls are chained, where the output of one call informs the input of the next, defining a sequence of 'productions'.","Biases the LLM towards desired outputs, enables complex algorithms, facilitates multi-step reasoning, and allows for dynamic, context-sensitive interactions with the LLM.","['LLM-based Reasoning', 'Deliberative Decision Making (Planning with LLMs)']","Question answering, few-shot learning (Brown et al. 2020), dynamic context-sensitive prompts (Liu et al. 2021), self-critique (Wang et al. 2022b), selection-inference (Creswell et al. 2023), multi-step problem solving.",0,
End-to-End Retrieval Augmented Generation for Domain Adaptation (RAGend2end),"Original Retrieval Augmented Generation (RAG) models are not optimized for specialized domains (e.g., healthcare, news) because their external knowledge base and passage encodings are fixed during finetuning, leading to poor domain adaptation. Re-encoding and re-indexing a large knowledge base synchronously during training is computationally expensive and inefficient.","Developing RAG systems for Open-Domain Question Answering (ODQA) that need to perform effectively in specialized, domain-specific knowledge bases, rather than just general Wikipedia-based knowledge. The system requires dynamic adaptation of both its retrieval and generation components to new domains.","Implement a joint training mechanism for RAG where both the neural retriever (Dense Passage Retrieval's question and passage encoders) and the generator (BART seq2seq model) are finetuned simultaneously for the end QA task. Crucially, the external knowledge base's passage encodings and index are updated asynchronously in parallel processes (re-encoding on dedicated GPUs, re-indexing with FAISS on CPUs) to avoid stalling the main training loop. This allows the entire RAG architecture, including its knowledge base, to adapt to the new domain.","Significantly improved domain adaptation performance (Exact Match, F1, Top-k retrieval accuracy) across various specialized domains (COVID-19, News, Conversations) compared to the original RAG. The approach demonstrates superior retriever adaptation compared to standalone retriever finetuning and can be used to train neural retrievers for retrieval-only applications.",['Statement Reconstruction (Auxiliary Training Signal)'],"Open-Domain Question Answering (ODQA) in specialized domains, improving the adaptability of RAG-like models, training domain-specific neural retrievers, reducing the need for gold-standard passages for retriever training.",0,
