,Pattern Name,Problem,Context,Solution,Result,Related Patterns,Uses,Category,Cluster Number,AI Design Pattern Category
0,LLMs as Knowledge Base,"Traditional knowledge graphs (KGs) for recommender systems are limited, sparse, expensive to construct/complete, and lack extensive factual and cross-domain knowledge, leading to suboptimal recommendation performance.","Recommender systems that can benefit from explicit knowledge to understand user-item relationships, enhance explainability, and provide cross-domain recommendations.","Leverage Large Language Models (LLMs) to retrieve factual and commonsense knowledge. LLMs are used for knowledge graph completion (predicting missing facts, entities, relations) and knowledge graph construction (entity discovery, coreference resolution, relation extraction, end-to-end KG building from raw text). This includes distilling commonsense facts from LLMs.","More extensive and up-to-date knowledge bases, improved understanding of entity relations, enhanced recommendation accuracy, relevance, and personalization, particularly for cross-domain scenarios. Automation of knowledge graph construction.","['LLMs as Content Interpreter', 'LLMs as Explainer']","Enhancing Click-Through Rate (CTR) prediction models, graph augmentation strategies, determining complementary relationships between entities in industrial recommenders.","['Knowledge & Reasoning Patterns', 'LLM-specific Patterns']",13,
1,LLMs as Content Interpreter,"Content-based recommender systems often suffer from sparse content features and traditional methods struggle to capture deep semantic information, long-context dependencies, and generalize effectively from textual content.","Recommender systems that rely on textual attributes and characteristics of items (e.g., news articles, product descriptions, reviews) to understand item properties and match user preferences.","Employ powerful pretrained language models (PLMs) like BERT and GPT as advanced content interpreters. This involves fine-tuning PLMs for recommendation-specific objectives, initializing news encoders with PLMs, using PLMs to generate universal continuous representations from item descriptions for cold-start and cross-domain recommendations, and instruction tuning to formulate recommendation as an instruction-following task.","Enhanced understanding and interpretation of textual content, improved recommendations, better capture of user interests, alleviation of cold-start problems, facilitation of cross-domain recommendations, and strong generalization abilities.","['LLMs as Knowledge Base', 'Prompt Design Patterns']","News recommendation, tag recommendation, tweet representations, code example recommendation, zero-shot/few-shot recommendation, rating prediction, sequential recommendation.","['LLM-specific Patterns', 'Personalization Pattern']",13,
2,LLMs as Explainer,"Most recommender systems are black boxes, leading to a lack of transparency and diminished user trust. Traditional explanation methods are often formulaic, lack diversity, and are tightly coupled with specific models, limiting generalizability.","Recommender systems where users desire comprehensible, persuasive, and transparent justifications for recommendations, and where system errors need to be identifiable.","Leverage LLMs' generative ability, extensive training data, and in-context learning capabilities (zero-shot, few-shot, Chain-of-Thought prompting) to craft customized, precise, natural, and adaptable explanations. LLMs can also provide model-agnostic interpretations of complex deep learning recommendation models.","Improved user trust, transparency, and satisfaction; more diverse and coherent explanations; real-time feedback integration; a versatile and scalable interpretation framework applicable across various recommendation models.","['Prompt Design Patterns', 'AI–Human Interaction Patterns', 'Generative AI Patterns']","Generating justifications for drug recommendations, product recommendations, and general explainable recommendations.","['AI–Human Interaction Patterns', 'LLM-specific Patterns', 'Generative AI Patterns', 'Prompt Design Patterns']",13,
3,LLMs as Common System Reasoner (Direct Recommendation),"Traditional recommendation models typically require explicit training or fine-tuning for new tasks or domains, making adaptation to new cases without extensive data and training challenging.","Recommender systems aiming to provide recommendations (e.g., rating prediction, ranking prediction) with minimal or no explicit training, especially when operating on open-domain datasets.","Utilize LLMs' emergent abilities of in-context learning (zero-shot/few-shot) and step-by-step reasoning (Chain-of-Thought). By providing natural language instructions and/or a few input-output demonstrations in the prompt, LLMs can generate recommendations without explicit training. Chain-of-Thought prompting guides LLMs to break down complex tasks into intermediate reasoning steps.","Ability to make predictions on new recommendation cases with minimal or no training, improved recommendation performance through multi-step reasoning, particularly effective in open-domain scenarios.","['Prompt Design Patterns', 'LLM-specific Patterns', 'Knowledge & Reasoning Patterns']","Rating prediction, ranking prediction, sequential recommendation, and reranking tasks in open-domain datasets like MovieLens and Amazon Books.","['LLM-specific Patterns', 'Prompt Design Patterns', 'Knowledge & Reasoning Patterns', 'Personalization Pattern']",13,
4,LLMs as Common System Reasoner (Automated Selection for AutoML),"Automated Machine Learning (AutoML) in recommender systems involves complex, large search spaces (e.g., embedding size, features, interactions, model architecture) and costly manual setup or time-consuming traditional search strategies.","The design and optimization of recommender systems, particularly in areas like Neural Architecture Search (NAS) and feature engineering, where automation is desired to reduce manual effort and improve efficiency.","Leverage LLMs' memorization and reasoning capabilities to automate aspects of AutoML. LLMs can generate network architectures, act as black-box agents to propose better-performing architectures based on past trials, or be integrated into existing search algorithms (e.g., genetic algorithms) to guide the search process and generate candidate crossovers/mutations.","Reduced manual effort and improved efficiency in AutoML for recommender systems, generation of reasonable or better-performing architectures, and enhanced search performance when LLMs are integrated with other optimization algorithms.","['Planning Patterns', 'LLM-specific Patterns', 'Knowledge & Reasoning Patterns']","Neural Architecture Search (NAS) for recommender systems, feature interaction search.","['MLOps Patterns', 'Planning Patterns', 'LLM-specific Patterns', 'Knowledge & Reasoning Patterns']",13,
5,LLMs as Conversational Agent,"Traditional conversational recommender systems (CRSs) face challenges with scalability, lack of synergy between components, and a high demand for supervised training data. They also struggle to maintain context and memory over long conversations due to token limits.","Personalized assistance and recommendation systems that interact with users through natural language dialogues to uncover preferences, provide real-time recommendations, and adapt strategies based on user feedback.","Employ LLMs as the core of CRSs due to their inherent conversational abilities, intelligence, and knowledge. This involves: 1) Leveraging LLMs' pre-trained conversational capabilities. 2) Fine-tuning LLMs with private, domain-specific dialogue data, potentially generated by user simulators. 3) Utilizing tool learning, where LLMs act as controllers to integrate and use traditional recommendation models or external data sources. 4) Implementing memory augmentation techniques to store and retrieve user profiles and facts from long dialogue contexts.","Real-time understanding of user intents, adaptive and personalized recommendations, reduced data dependency for generative dialogue models, improved handling of private domain data, and enhanced ability to manage long conversational contexts.","['Tools Integration Patterns', 'Prompt Design Patterns', 'LLM-specific Patterns', 'AI–Human Interaction Patterns']","Building enterprise-level CRSs, open-domain recommendations (movies, music, news, games), personalized assistants.","['Agentic AI Patterns', 'AI–Human Interaction Patterns', 'LLM-specific Patterns', 'Tools Integration Patterns', 'Personalization Pattern']",13,
6,LLM-based Tool Learning,"LLMs have limitations in accessing knowledge beyond their training data, performing complex computations, or interacting with external systems. They may also struggle to break down complex tasks into executable subtasks autonomously.",Any AI system where foundational models (LLMs) need to enhance their task-solving capabilities by combining with specialized external tools to overcome inherent limitations.,"Apply LLMs as intelligent controllers to select, manage, and interact with various existing AI models or specialized tools. LLMs comprehend problem statements, decompose tasks into subtasks, convert them into executable instructions for tools, and then aggregate the results. This can involve LLMs learning to use tools through self-supervised methods or acting as autonomous agents.","Enhanced task-solving capabilities beyond the LLM's intrinsic knowledge, more accurate and efficient solutions for complex problems, access to external, real-time knowledge and functionalities, and improved generalization across diverse tasks.","['Agentic AI Patterns', 'Prompt Design Patterns', 'LLM-specific Patterns']","Solving general AI tasks (e.g., HuggingGPT), complex visual tasks (Visual ChatGPT), web browsing, mathematical reasoning, robotic tasks, and general downstream tasks.","['Tools Integration Patterns', 'Agentic AI Patterns', 'LLM-specific Patterns']",11,
7,LLM-augmented Recommendation Engine,"LLMs struggle to memorize domain-specific knowledge (e.g., item corpora, user profiles) and are susceptible to temporal generalization problems (external knowledge evolving), leading to inaccurate or non-grounded recommendations in personalized systems.","Personalization scenarios where LLMs act as recommendation agents but require grounding in specific, up-to-date, or private domain item corpora and detailed user data.","Equip LLMs with external tools, specifically dedicated recommendation engines, search engines, and databases. The LLM acts as an orchestrator, using search engines for external knowledge, a multi-stage recommendation engine (retrieve and rerank) to ground recommendations in item corpora, and databases (e.g., vector databases, user profile modules) to handle cold-start items or store/retrieve user-specific facts.","Recommendations grounded in specific item corpora, ability to handle private/domain-specific knowledge, alleviation of cold-start and temporal generalization problems, more factual and personalized responses, and improved understanding of user intent.","['LLM-based Tool Learning', 'LLMs as Conversational Agent', 'Personalization Pattern']","Music recommendation, content recommendation, and general personalized recommendations in conversational settings.","['Tools Integration Patterns', 'Personalization Pattern', 'LLM-specific Patterns']",13,
8,LLMs as Personalized Content Creator,"Traditional recommender systems primarily suggest existing items. There is a growing need to generate appealing, customized digital content that directly matches individual user interests, especially in areas like online advertising, where existing methods often use predefined templates or struggle with sparse feedback.","Online advertising, e-commerce, customer service, and other scenarios where personalized, engaging digital content (text, images, multi-modal) needs to be generated to enhance user experience and drive business growth.","Integrate AI-Generated Content (AIGC) powered by LLMs into recommender systems. LLMs provide enhanced reasoning for user personalized intent and interest, even with few-shot prompting. Reinforcement Learning from Human Feedback (RLHF) can be applied to fine-tune models to better capture user intent. LLMs' powerful generative abilities and cross-modal knowledge bases enable realistic creation of text, images, and other multi-modal content. Interactive generation processes with feedback loops allow for better capture of explicit user preferences.","More appealing, customized, and realistic content generated for users; improved understanding of explicit user preferences; enhanced user experiences; and increased business growth through personalized content.","['Generative AI Patterns', 'Personalization Pattern', 'AI–Human Interaction Patterns']","Text ad generation (ad titles, descriptions), image generation, chatbots for personalized product recommendations, automated customer service responses, and FAQs.","['Generative AI Patterns', 'Personalization Pattern', 'LLM-specific Patterns', 'AI–Human Interaction Patterns']",13,
9,Agent-Computer Interface (ACI),"Language Model (LM) agents struggle to interact effectively with complex digital environments (e.g., Linux shell, human-designed IDEs) due to mismatched abilities, verbose feedback, and unoptimized action spaces, leading to poor performance and error propagation.","Designing or deploying LM agents to automate complex tasks in digital environments (like software engineering) that were originally designed for human users or have granular, low-level interfaces. LMs have limitations such as lacking visual understanding and sensitivity to context window size.","Introduce an abstraction layer, the Agent-Computer Interface (ACI), between the LM agent and the computer environment. This interface provides a curated set of high-level, LM-friendly commands, structured and concise environment feedback, and built-in guardrails tailored to the LM's strengths and weaknesses. It also manages interaction history and formats input for the LM.","Substantially improved LM agent performance, enhanced ability to interact with the environment (e.g., file creation, editing, navigation, test execution), and increased task success rates compared to using raw, human-centric interfaces. Achieved state-of-the-art performance on benchmarks like SWEbench.","['Agentic AI Patterns', 'LLM-specific Patterns', 'Tools Integration Patterns', 'AI–Human Interaction Patterns']","['Automating software engineering tasks (SWEagent)', 'General computer control', 'Web navigation']",,7,
10,Simple and Understandable Actions,"Language Model (LM) agents struggle to reliably use complex commands with many options and verbose documentation (e.g., many bash commands), leading to misinterpretations, incorrect usage, and an increased need for demonstrations or fine-tuning.","Designing the action space for LM agents interacting with a digital environment, especially when the underlying system offers highly configurable but complex commands.","Design commands with a small number of clear, intuitive options and concise, easy-to-understand documentation. Prioritize clarity over extensive configurability for LM agents to reduce their cognitive load.","Reduces the cognitive load on the LM, decreases the likelihood of command misusage, and improves the agent's ability to effectively interact with the environment without extensive prior examples or fine-tuning.","['Agentic AI Patterns', 'Prompt Design Patterns', 'LLM-specific Patterns']","['Defining commands for file system navigation (e.g., `findfile`, `searchfile`, `searchdir`)', 'File editing (e.g., `edit`)', 'General environment interaction in agent-computer interfaces']",,7,
11,Compact and Efficient Actions,"Language Model (LM) agents can get stuck in inefficient loops or exhaust their context window and computational budget when higher-order operations require composing many simple, granular actions across multiple turns, hindering meaningful progress towards a goal.","Designing the action space for LM agents in an interactive environment where tasks involve multi-step operations (e.g., multi-line editing, complex search workflows).","Consolidate important, frequently composed operations into as few actions as possible. Design actions that enable the agent to make meaningful progress towards a goal in a single step, rather than requiring multiple turns for a basic effect.","Improves agent efficiency, reduces the number of interaction turns, conserves context window space, and accelerates task completion.","['Agentic AI Patterns', 'LLM-specific Patterns', 'Context Window Optimization']","['File editing (e.g., `edit` command replacing a range of lines in one step)', 'Search and navigation (e.g., summarized search results instead of iterative, one-by-one results)']",,7,
12,Informative but Concise Environment Feedback,"Language Model (LM) agents can be overwhelmed by verbose or irrelevant environment feedback, which consumes valuable context window space and computational resources, and can distract from critical information, leading to reduced performance. Conversely, too little feedback makes it difficult to understand the current state or the effect of actions.",Providing feedback to LM agents after their actions in an interactive digital environment.,"Design environment feedback to be substantive, providing crucial information about the current state and the immediate effects of the agent's actions, while strictly avoiding unnecessary details or verbose output. This includes displaying updated content after an edit, contextualizing file views with line numbers, and providing specific messages for silent command successes.","Enhances the agent's understanding of the environment, helps it focus on relevant information, reduces context window bloat, and improves decision-making without incurring excessive computational costs.","['LLM-specific Patterns', 'Prompt Design Patterns', 'Context Window Optimization']","['File viewer output (windowed view with line numbers and context indicators)', 'Feedback after file edits (showing updated content)', 'Search results (summarized results)', ""Success messages for silent commands (e.g., 'Your command ran successfully and did not produce any output')""]",,7,
13,Guardrails for Error Mitigation and Recovery,"Language Model (LM) agents frequently make mistakes (e.g., syntax errors in code edits, invalid commands, overly broad search queries) and can struggle to recognize these errors, recover from them, or prevent cascading failures, significantly hindering task performance.",Designing interactive systems for LM agents where agent actions can introduce errors or lead to unproductive states.,"Implement automated checks and interventions (guardrails) that detect common agent mistakes, prevent the propagation of errors, and provide clear, actionable feedback to guide recovery. Examples include code syntax checkers that block invalid edits, mechanisms to discard malformed commands, and suggestions to refine overly broad search queries.","Reduces the frequency and impact of agent errors, improves the agent's ability to self-correct, shortens recovery times, and enhances overall task reliability and success rates.","['Agentic AI Patterns', 'LLM-specific Patterns', 'Prompt Design Patterns']","['Integrated code linter for file editing (discards edits with syntax errors, shows error message and diff)', 'Search command limits (suggests refining queries if too many results)', 'Error responses for malformed agent generations']",,7,
14,Context Window Optimization (for History and Viewing),"Language Models (LMs) have finite context windows, and providing a full, unmanaged history of interactions or extensive file content can quickly exhaust this limit, leading to 'lost in the middle' phenomena, increased inference costs, and reduced performance.","Managing the information presented to an LM agent during a multi-turn interaction with a digital environment, particularly concerning long interaction histories and large files.","Implement strategies to keep the agent's context concise and relevant. This includes collapsing older observations into single-line summaries, limiting the window of visible lines when viewing large files, and selectively omitting redundant or less critical historical information while preserving essential plan and action history.","Maximizes the number of interaction turns possible within the LM's context window, reduces inference costs, improves the LM's ability to focus on recent and critical information, and mitigates performance degradation due to excessive context.","['LLM-specific Patterns', 'Prompt Design Patterns', 'Agentic AI Patterns']","['Collapsing observations preceding the last N turns in the history', 'Windowed file viewer (e.g., showing at most 100 lines of a file at a time)', 'History processors to manage message history length']",,7,
15,Specialized Search Interface,"Language Model (LM) agents struggle with traditional, verbose search tools (e.g., `grep`, `find` with many options) that can return overwhelming amounts of irrelevant information, exhaust context windows, or require inefficient iterative exploration to find relevant content.",Enabling LM agents to efficiently locate specific files or content within a large codebase or digital repository.,"Provide specialized, LM-friendly search commands that offer targeted search capabilities (e.g., `findfile` for names, `searchfile` for strings in files, `searchdir` for strings in directories). These commands should prioritize summarized, filtered results, and provide guidance for refining queries if initial searches yield too many results.","Improves the agent's efficiency in code localization, reduces the amount of irrelevant information presented, conserves context window space, and helps agents quickly zoom in on problematic areas.","['Agentic AI Patterns', 'Tools Integration Patterns', 'Informative but Concise Environment Feedback', 'Guardrails for Error Mitigation and Recovery']","['`findfile`, `searchfile`, `searchdir` commands in SWEagent, including features like limiting results (e.g., to 50 matches) and suggesting more specific queries.']",,7,
16,Efficient File Editing,"Language Model (LM) agents find file editing cumbersome and error-prone when relying on low-level, multi-step commands (e.g., `sed` for single-line changes, redirection for entire file replacement) that lack immediate feedback and require complex arithmetic or state tracking. This leads to inefficiency, cascading errors, and poor performance.","Enabling LM agents to modify code or text files within a digital environment, especially in software engineering tasks.","Provide a consolidated, high-level `edit` command that works in conjunction with a file viewer. This command should allow for replacing a specific range of lines with new text in a single action, automatically display the updated content, and ideally integrate guardrails like syntax checking.","Streamlines the editing process, reduces the number of actions required for multi-line changes, provides immediate and clear feedback on modifications, and mitigates syntax-related errors, significantly improving agent productivity and accuracy.","['Agentic AI Patterns', 'Tools Integration Patterns', 'Compact and Efficient Actions', 'Informative but Concise Environment Feedback', 'Guardrails for Error Mitigation and Recovery']","[""SWEagent's `edit` command, which takes start/end lines and replacement text, displays updated content, and integrates a code linter.""]",,7,
17,LLM-Assisted Symbolic World Model Construction,"Manually creating accurate and comprehensive symbolic world models (e.g., PDDL) is time-consuming and requires specialized expertise. Direct LLM planning is unreliable for correctness.",A reliable symbolic world model is needed for classical planning or plan validation. Users may lack expertise in formal symbolic languages like PDDL.,"Leverage Large Language Models (LLMs), such as GPT-4, to generate PDDL domain models from natural language descriptions of actions and domain context. This involves careful prompt engineering, iterating over actions, and maintaining a shared predicate list for consistency.","High-quality PDDL models are produced for complex domains, significantly reducing the burden on human experts and enabling the use of sound classical planners or robust plan validators.","['Natural Language to Formal Representation', 'Structured Prompt for Model Generation', 'Iterative Model Construction with Shared Predicate List', 'LLM for Knowledge Acquisition']","['Generating PDDL models for classical planners', 'Validating LLM-generated plans', 'Guiding skill learning for embodied agents']",,10,
