Pattern Name,Problem,Context,Solution,Result,Related Patterns,Uses,Cluster Number,Category
ParameterServer Abstraction,Lack of widely accepted abstractions for distributed learning.,"Distributed learning environments where data and workloads need to be distributed across worker nodes, and global parameters need to be maintained.","Distribute both data and workloads over worker nodes, while server nodes maintain globally shared parameters (represented as vectors and matrices).",Provides a structured abstraction for managing parameters and workloads in distributed ML training.,[],Distributed learning.,7,
ClosedLoop Intelligence,"Addressing big, open-ended, time-changing, or intrinsically hard problems with ML.","ML systems designed to tackle complex, evolving, or difficult problems that benefit from continuous feedback and interaction.",Connect machine learning to the user and close the loop. Design clear interactions along with implicit and direct outputs.,Improves the ability of ML systems to address complex problems by incorporating user feedback and interaction.,"['Distinguish Business Logic from ML Models', 'DataAlgorithmServingEvaluator']","Systems addressing big, open-ended, time-changing, or intrinsically hard problems.",8,
Federated Learning,"Standard machine learning approaches require centralizing training data, which is often not feasible due to privacy concerns or data locality (e.g., mobile devices).","Scenarios where training data cannot be centralized on one machine or in a datacenter, such as mobile devices or sensitive enterprise data.","Employ Federated Learning, which enables devices (e.g., mobile phones) to collaboratively learn a shared prediction model while keeping all training data on the device.",Enables collaborative model learning and deployment while preserving data privacy and reducing data transfer.,['Secure Aggregation'],"Mobile phones, privacy-sensitive data, distributed learning without data centralization.",9,
ML Versioning,"ML models and their multiple versions can change the behavior of overall ML applications, making reproducibility difficult.","ML application development where model changes, data changes, or training system changes can impact application behavior and require reproducibility.","Record the ML model structure, training data, and training system to ensure a reproducible training process.",Ensures a reproducible training process and helps manage the impact of ML model changes on application behavior.,[],"Managing ML model changes, ensuring reproducibility of training processes.",10,
Handshake,"An ML system depends on inputs delivered outside of the normal release process, leading to potential issues if these inputs change unexpectedly.",ML systems that rely on external data sources or inputs that are not managed within the standard software release cycle.,"Create a handshake normalization process, regularly check for significant changes in external inputs, and send ALERTS.","Provides a mechanism to monitor and manage external data dependencies, preventing unexpected behavior due to input changes.",[],"Managing external data dependencies for ML systems, ensuring input stability.",11,
Isolate and Validate Output of Model,"Machine learning models are known to be unstable, vulnerable to adversarial attacks, and susceptible to noise in data and data drift over time.","Deploying ML models in production where robustness, security, and reliability are critical, given the inherent vulnerabilities of ML models.",Encapsulate ML models within rule-based safeguards and use redundant and diverse architecture that mitigates and absorbs the low robustness of ML models.,"Mitigates instability, vulnerability to attacks, and low robustness of ML models, improving their reliability and security in production.",[],"Improving robustness, security, and reliability of ML models in production.",12,
Canary Model,A surrogate ML model that approximates the behavior of the best ML model is needed to provide explainability and monitor performance.,"Situations where understanding model behavior, detecting performance degradation, or providing explanations for predictions is crucial.",Run the canary inference pipeline in parallel with the primary inference pipeline to monitor prediction differences.,"Provides a mechanism for model monitoring, detecting prediction differences, and contributing to explainability.",[],"Model monitoring, explainability, detecting performance degradation.",13,
Decouple Training Pipeline from Production Pipeline,It is necessary to separate and quickly change the ML data workload and stabilize the training workload to maximize efficiency.,"ML development and deployment environments where training and production workloads have different requirements (e.g., training needs flexibility and experimentation, production needs stability and efficiency).",Physically isolate different workloads to different machines. Then optimize the machine configurations and network usage for each.,"Maximizes efficiency by allowing independent optimization and management of ML training and production workloads, and enables quicker changes to data workloads.",[],"Managing ML training and production environments, optimizing resource allocation.",14,
Descriptive Data Type for Rich Information,"The rich information used and produced by ML systems is often encoded with plain data types (e.g., raw floats, integers), losing semantic meaning and making systems less robust or interpretable.","Designing ML systems where interpretability, robustness, and clear understanding of model parameters and predictions are important.","Design a robust system where model parameters (e.g., logodds multiplier, decision threshold) and predictions carry explicit information about their meaning and origin.",Creates a more robust and interpretable system by embedding rich semantic information into ML-related data types.,[],"Improving interpretability, robustness, and clarity of ML model parameters and predictions.",15,
Design Holistically about Data Collection and Feature Extraction,"The system to prepare data in an ML-friendly format can become a 'pipeline jungle,' making management difficult and costly.","Developing ML systems that involve complex data preparation, cleaning, and feature engineering processes.",Avoid 'pipeline jungles' by adopting a holistic approach to data collection and feature extraction from the outset.,Dramatically reduces ongoing costs and complexity associated with managing ML data pipelines.,[],Designing ML data collection and feature extraction processes to prevent complexity.,16,
Reuse Code between Training Pipeline and Serving Pipeline,Training-serving skew can occur due to discrepancies in how data is handled between the training and serving pipelines.,ML systems where consistency between the data processing logic used during model training and model inference is critical to avoid performance degradation.,"Reuse code between the training pipeline and serving pipeline, for example, by preparing objects that store results in an understandable way for humans.","Prevents training-serving skew, ensuring consistent data handling and model performance across training and serving environments.",[],Ensuring consistency and preventing skew between ML training and serving pipelines.,17,
Secure Aggregation,"In distributed learning, the system needs to communicate and aggregate model updates in a secure, efficient, scalable, and fault-tolerant way.","Distributed machine learning, particularly in Federated Learning, where individual device data must remain private while contributing to a global model.",Encrypt data from each mobile device in Federated Learning and calculate totals and averages without individual examination.,"Enables secure, efficient, scalable, and fault-tolerant aggregation of model updates while preserving data privacy.",['Federated Learning'],Securely aggregating model updates in Federated Learning and other distributed ML scenarios.,9,
Workflow Pipeline,Creating an end-to-end reproducible training and deployment pipeline for a machine learning component is difficult. Data science notebooks can run a whole pipeline but they do not scale.,"Developing and deploying machine learning components where reproducibility, scalability, and maintainability of the pipeline steps are crucial.",Make each pipeline step a separate containerized service. Services are orchestrated and chained together to form pipelines that can be run via REST API calls.,"The portability, scalability, and maintainability of the individual pipeline steps is improved at the cost of an overall more complex solution.",[],Presented at AWS Blog.,18,
Distinguish Business Logic from ML Model,"Machine Learning (ML) systems are complex because their ML components must be retrained regularly and have an intrinsic non-deterministic behavior. Similar to other systems, the business requirements for these systems as well as ML algorithms change over time.","Designing systems that integrate machine learning components with traditional business logic, where ML models require frequent updates and exhibit non-deterministic behavior.",Define clear APIs between traditional and ML components. Place business and ML components with different responsibilities into three layers. Divide data flows into three.,"Improved management of complexity, retraining, and changing requirements in ML systems by clearly separating concerns.",[],[],4,
Encapsulating ML Models within Rule-based Safeguards,"It is impossible to guarantee the correctness of ML model predictions, so they should not be directly used for safety or security-related functions. Furthermore, ML models can be unstable and vulnerable to adversarial attacks, data noise, and drift.","Deploying ML models in safety or security-critical applications, or in environments where model robustness, reliability, and resistance to adversarial attacks are paramount.","Introduce a deterministic rule-based mechanism that decides what to do with the prediction results, e.g., based on additional quality checks.",Reduced risk for negative impacts of incorrect predictions but a more complex architecture.,[],[],12,
AI Pipeline,Complex prediction or synthesis use cases are often difficult to accomplish with a single AI tool or model.,"Scenarios requiring the combination of multiple AI capabilities or models to achieve a complex, multi-step AI task during inference.","Divide the problem into smaller consecutive steps, then combine several existing AI tools or custom models into an inference-time AI pipeline where each specialized tool or model is responsible for a single step.","More tools and models need to be integrated, but the provided result is of higher quality. Each step can be optimized individually.",[],Typical computer vision inference pipelines.,19,
Two-Phase Predictions,"Executing large, complex models can be time-consuming and costly, especially if lightweight clients like mobile or IoT devices are involved.","Deploying ML models to resource-constrained or latency-sensitive clients, where a full, complex model inference is not always necessary or feasible.","Split the prediction into two phases. A simple, fast model is executed first on the client. Afterwards, a large, complex model is optionally executed in the cloud for deeper insights.","Prediction response time is reduced for some cases. The number of large, expensive predictions is reduced. The client has a fallback model when there is no Internet connection.",[],Voice activation in AI assistants like Alexa or Google Assistant.,20,
Ethics Credentials,"Responsible AI requirements are either omitted or mostly stated as high-level objectives and not specified explicitly in a verifiable way as expected system outputs. Because of this, users may trust an AI system less or even refrain from using it.","Developing AI systems where building user trust, ensuring ethical compliance, and demonstrating responsible AI practices are critical.","Provide verifiable ethics credentials for your AI system or component. Using publicly accessible and trusted data infrastructure, the credentials can be verified as proof of ethical compliance. Additionally, users may also have to verify their credentials before getting access to the AI system.","Trust and system acceptance increases and awareness of ethical issues is raised. However, a trusted public data infrastructure is needed and credentials need to be maintained and potentially refreshed from time to time.",[],[],21,
Deploy Canary Model,"You trained a new model with assumed better prediction quality, but it's not certain if this will carry over to production. Additionally, there could be other quality issues with the new model that should not affect all users in production at once.","Deploying new or updated ML models to a production environment, where the risk of introducing regressions or performance degradation needs to be minimized.","Deploy the new model in addition to the existing ones and route a small number of requests to it to evaluate its performance. If this test is successful, all existing models can be replaced. If not, the new model needs to be improved.",Only a small number of users are subjected to potential bugs or low-quality predictions. Additional serving and monitoring infrastructure is required.,[],[],13,
Agent Profiling,Autonomous agents need to assume specific roles and characteristics to perform tasks effectively and influence the behavior of Large Language Models (LLMs) in a consistent and meaningful way.,"Designing LLM-based autonomous agents for specific tasks, simulations, or multi-agent systems where distinct roles, personalities, or social information are required to guide agent behavior.","Define agent profiles that encompass basic information (e.g., age, gender, career), psychological information (e.g., personalities), and social information (e.g., relationships between agents). These profiles are typically incorporated into the LLM's prompt to influence its responses and actions. Profiles can be generated through: 
- **Handcrafting:** Manually specifying agent characteristics (e.g., 'you are an outgoing person').
- **LLM-generation:** Automatically generating profiles based on predefined rules and seed examples using LLMs.
- **Dataset Alignment:** Obtaining profiles from real-world datasets (e.g., demographic backgrounds) to ensure agents reflect attributes of a real population.","Agents exhibit behaviors consistent with their assigned roles, personalities, or social information, leading to more realistic simulations, effective collaboration in multi-agent systems, and task accomplishment aligned with specific personas.","['Agent Memory Management', 'Agent Planning', 'Agent Action Execution', 'Prompt and Mechanism Engineering for Agent Capability Acquisition']","Social simulations (e.g., Generative Agent, AgentSims), multi-agent collaboration (e.g., MetaGPT, ChatDev, Self-collaboration for software development), personality trait exploration (e.g., PTLLM), toxicity studies of LLM output, user behavior simulation (e.g., RecAgent).",0,
Agent Memory Management,"LLM-based autonomous agents need to effectively store, retrieve, and process past information (perceptions, behaviors, thoughts) to accumulate experiences, self-evolve, and behave in a consistent, reasonable, and effective manner, overcoming the inherent context window limitations of LLMs.","LLM-based autonomous agents operating in continuous and dynamic environments that require long-range reasoning, learning from past interactions, and maintaining behavioral consistency over extended periods.","Implement a memory module inspired by human cognitive processes, typically combining short-term and long-term memory components, and defining formats and operations for memory interaction.
- **Memory Structures:**
  - **Unified Memory (Short-term):** Information is directly written into the LLM's context window for recent perceptions and in-context learning.
  - **Hybrid Memory (Short-term + Long-term):** Combines the context window for immediate information with external vector storage (e.g., vector databases) for consolidating and retrieving important, older information based on relevance.
- **Memory Formats:** Information can be stored as natural language, embeddings (for efficient retrieval), structured lists (e.g., hierarchical trees for subgoals, triplet phrases), or in databases (allowing SQL-like manipulation).
- **Memory Operations:**
  - **Memory Reading:** Extract relevant information based on criteria like recency, relevance, and importance scores.
  - **Memory Writing:** Store new perceptions, with strategies to handle memory duplication (e.g., condensing similar records) and overflow (e.g., FIFO, explicit deletion).
  - **Memory Reflection:** Agents independently summarize past experiences into more abstract, high-level insights, which can then be used to guide future actions or generate new insights hierarchically.","Agents gain the ability to accumulate experiences, maintain long-term consistency, perform long-range reasoning, and adapt their behavior based on past interactions, leading to more human-like and effective task accomplishment in complex environments.","['Agent Profiling', 'Agent Planning', 'Agent Action Execution', 'Prompt and Mechanism Engineering for Agent Capability Acquisition']","Conversation agents (e.g., RLP, SCM, MemorySandbox), embodied agents (e.g., SayPlan, DEPS, Generative Agent, AgentSims, GITM, Reflexion, SimplyRetrieve), knowledge management (e.g., MemoryBank, ChatDB, DBGPT, RETLLM), multi-agent collaboration (e.g., ChatDev, MetaGPT).",0,
Agent Planning,"LLM-based autonomous agents need to effectively decompose complex, long-horizon tasks into simpler subtasks and determine future actions, often in dynamic and unpredictable environments, to achieve goals.","LLM-based autonomous agents operating in environments that require multi-step reasoning, strategic decision-making, and adaptation to changes or failures during task execution.","Implement a planning module that empowers agents with human-like planning capabilities, enabling them to generate and, optionally, revise plans based on feedback.
- **Planning without Feedback:** Agents generate plans in a one-shot manner without iterative refinement based on execution outcomes.
  - **Single-path Reasoning (e.g., Chain of Thought - CoT):** Decomposes tasks into a linear sequence of intermediate steps, guiding the LLM to generate plans step-by-step, often using few-shot examples or trigger phrases.
  - **Multi-path Reasoning (e.g., Tree of Thoughts - ToT):** Explores multiple reasoning paths in a tree-like structure, allowing the agent to consider various options at each step and select the most promising one using search algorithms (e.g., BFS, DFS) or LLM evaluation.
  - **External Planner:** Leverages specialized, efficient external planning algorithms (e.g., PDDL solvers) by translating LLM-generated task descriptions into formal planning languages and then back into natural language actions.
- **Planning with Feedback:** Agents iteratively generate and refine plans based on real-time information received after taking actions.
  - **Environmental Feedback:** Incorporates objective signals from the environment (e.g., task completion status, observations, execution errors, scene graph updates) to adjust subsequent plans.
  - **Human Feedback:** Integrates subjective human input (e.g., corrections, preferences, clarifications) to align agent plans with human values and preferences, and to mitigate issues like hallucination.
  - **Model Feedback (Self-Refinement):** Utilizes internal feedback generated by the agent itself or auxiliary LLMs (e.g., self-critique, evaluation of reasoning steps, detailed verbal feedback) to identify and correct planning errors.","Agents can effectively tackle complex, long-horizon tasks by breaking them down, generating coherent action sequences, adapting to unforeseen circumstances, and continuously improving their planning capabilities, leading to more robust and human-like task accomplishment.","['Agent Profiling', 'Agent Memory Management', 'Agent Action Execution', 'Prompt and Mechanism Engineering for Agent Capability Acquisition']","Task planning for embodied agents (e.g., SayPlan, DEPS, LLMPlanner, Inner Monologue, Voyager, Ghost), general problem-solving (e.g., CoT, ToT, RAP), tool-use (e.g., HuggingGPT), software development (e.g., COLLM), robotics.",0,
Agent Action Execution,"LLM-based autonomous agents need to translate their internal decisions, plans, and retrieved memories into concrete, observable actions that interact with the environment, achieve specific goals, and potentially modify their internal state or trigger subsequent actions.","LLM-based autonomous agents operating in dynamic environments where they must perform physical or virtual actions, communicate, or explore, often requiring capabilities beyond the LLM's inherent knowledge or prone to hallucination.","Implement an action module that defines the goals, production strategies, available action space, and anticipated impacts of agent actions, influenced by the profiling, memory, and planning modules.
- **Action Goals:** Actions can be aimed at task completion (e.g., crafting an item, completing a function), communication (e.g., with other agents or humans for sharing information or collaboration), or environment exploration (e.g., discovering unknown skills or unfamiliar areas).
- **Action Production:** Actions are generated either by recalling relevant information from the agent's memory (Memory Recollection) or by strictly following pre-generated plans from the planning module (Plan Following).
- **Action Space:** Agents can leverage:
  - **External Tools:** To overcome LLM limitations (e.g., lack of expert knowledge, hallucination), agents can call external APIs (e.g., HuggingFace models, Python interpreters, RESTful APIs), query databases or knowledge bases for domain-specific information, or integrate other specialized external models (e.g., for multimodal processing).
  - **Internal Knowledge of LLMs:** Agents can rely on the LLM's inherent capabilities such as planning (decomposing complex tasks), conversation (generating high-quality dialogue), and common sense understanding (making human-like decisions).
- **Action Impact:** Actions can lead to changes in the environment (e.g., moving positions, collecting items, constructing buildings), alterations in the agent's internal states (e.g., updating memories, forming new plans, acquiring novel knowledge), or triggering new actions in a sequence.","Agents can effectively interact with their environment, achieve diverse goals, and adapt their behavior by strategically combining their internal LLM capabilities with external resources, leading to more versatile and capable autonomous systems.","['Agent Profiling', 'Agent Memory Management', 'Agent Planning', 'Prompt and Mechanism Engineering for Agent Capability Acquisition']","Embodied agents in games (e.g., Minecraft: Voyager, DEPS, GITM), software development (e.g., ChatDev, MetaGPT), recommendation systems (e.g., RecAgent), social simulations (e.g., Generative Agent, S3), robotics (e.g., SayCan, TidyBot), general tool-use (e.g., HuggingGPT, ToolFormer, Gorilla, ToolBench, RestGPT, TaskMatrixAI, ChemCrow, MMREACT).",0,
Finetuning for Agent Capability Acquisition,"LLM-based autonomous agents often lack task-specific capabilities, skills, and experiences required for effective performance in particular domains, beyond the general knowledge of the base LLM.","Enhancing the performance and versatility of LLM-based autonomous agents for specific tasks or domains, especially when using open-source LLMs or when a large amount of task-specific knowledge needs to be incorporated into the model's parameters.","Adjust the parameters of the underlying LLM by finetuning it on task-dependent datasets. This approach encodes task-specific knowledge directly into the model.
- **Finetuning with Human Annotated Datasets:** Utilize datasets manually created by human workers, often for aligning with human values, converting natural language to structured formats, or simulating specific human behaviors.
- **Finetuning with LLM Generated Datasets:** Leverage LLMs themselves to generate large-scale annotation data, offering a cost-effective and scalable alternative, though potentially with less perfect quality than human annotation.
- **Finetuning with Real-world Datasets:** Directly use datasets collected from real-world applications and interactions (e.g., web interaction logs, domain-specific text-to-SQL queries) to train agents for practical scenarios.","Agents acquire specialized knowledge, task-specific skills, and improved performance in targeted domains, leading to more accurate, aligned, and effective behavior by adjusting the model's internal parameters.",[],"Enhancing Agent Profiling (e.g., for uncommon roles or psychology characters), improving Agent Memory Management (e.g., for better natural language to structured memory conversion), refining Agent Planning (e.g., for domain-specific planning), boosting Agent Action Execution (e.g., for tool-using capability, web-related tasks, text-to-SQL tasks), aligning agents with human values (e.g., CoH), educational functions (e.g., EduChat), complex interactive reasoning (e.g., SWIFTSAGE).",0,
