85,Dense Passage Retrieval (DPR-like Retriever),"Inefficient and ineffective retrieval of relevant text passages from very large, unstructured text corpora given a natural language query, which is crucial for open-domain knowledge-intensive tasks.","Building retrieval components for knowledge-intensive AI systems that need to access large, unstructured text corpora (e.g., Wikipedia) to find relevant evidence or context for a subsequent task.","Employ a bi-encoder architecture: a query encoder (e.g., BERT-based) creates a dense vector representation of the query, and a document encoder (e.g., BERT-based) creates dense vector representations for all documents in the corpus. Retrieval is then performed by finding documents whose embeddings have the highest inner product similarity with the query embedding using Maximum Inner Product Search (MIPS). The retriever is often pretrained with retrieval supervision (e.g., to retrieve passages containing answers to questions).","Achieves high retrieval recall and precision for open-domain tasks. Enables fast approximate nearest neighbor search (MIPS using FAISS) even with millions of documents. Provides a strong foundation for 'learned retrieval' by being fine-tunable, making it an effective component in RAG models.","['Learned Retrieval', 'Retrieval-Augmented Generation (RAG)', 'BM25 (word overlap-based retriever, often a baseline or comparison point)']","['Open-domain Question Answering', 'Fact Verification', 'As the retrieval component in RAG models', 'Efficient document retrieval from large corpora']",,3,
86,Production System,"How to define systems capable of complex, hierarchically structured behaviors through iterative rule application, often for symbolic manipulation.","Originating in efforts to characterize the limits of computation (e.g., string rewriting), later adopted by the AI community to capture human problem solving.","A formalism consisting of a set of rules, each specifying a precondition and an action. When the precondition is met, the action can be taken, modifying a state (e.g., a string or logical state).","Generates a set of outcomes by iteratively applying rules, capable of complex behaviors, and can be shown to be Turing complete when control flow is imposed.","['Cognitive Architecture', 'Language Models as Probabilistic Production Systems']","String manipulation, formal languages (Chomsky's phrase structure grammar), logical systems, early AI problem-solving (e.g., thermostat agent).","['Classical AI', 'Knowledge & Reasoning']",11,
87,Cognitive Architecture,"How to build flexible, rational, real-time agents that mimic human cognition, explicitly instantiating processes such as perception, memory, and planning.","Building on production systems, AI researchers sought to integrate these rule-based systems with sensory input, actuators, and knowledge bases to achieve human-like problem-solving.","Augments a production system with sensory groundings, various types of long-term memory (procedural, semantic, episodic), and a generalized decision procedure for selecting, applying, and even generating new productions.","Agents capable of flexible, rational, and real-time behaviors, with structured internal state management and adaptive learning mechanisms.","['Production System', 'Modular Memory', 'Generalized Decision-Making Loop', 'Grounding Actions']","Psychological modeling, robotics, military simulations, intelligent tutoring (e.g., Soar architecture).","['Agentic AI', 'Classical AI', 'Knowledge & Reasoning']",11,
88,Modular Memory,"Large language models (LLMs) are stateless; how to enable language agents to persist, organize, and maintain information internally for multistep interactions with the world.","Designing language agents that require internal state to remember past interactions, store knowledge, track current goals, and support reasoning and planning across multiple LLM calls.","Organize information (primarily textual, but other modalities allowed) into multiple distinct memory modules, each containing a different form of information. These typically include short-term working memory and several long-term memories (episodic, semantic, and procedural).","Agents can maintain internal state, leverage past experiences, access world knowledge, and store operational procedures, overcoming the inherent statelessness of LLMs and enabling complex, long-duration interactions.","['Working Memory', 'Episodic Memory', 'Semantic Memory', 'Procedural Memory', 'Cognitive Architecture']","Language agents, cognitive language agents (e.g., CoALA framework), any AI system requiring persistent internal state.","['Agentic AI', 'Knowledge & Reasoning', 'LLM-specific']",29,
89,Working Memory,"How to manage active and readily available information for an agent's current decision cycle, including perceptual inputs, active knowledge, and intermediate reasoning results.","Within a language agent, needing a dynamic data structure that persists across LLM calls to track the agent's current circumstances and facilitate decision-making.","A memory module that maintains active and readily available information as symbolic variables for the current decision cycle. It stores perceptual inputs, active knowledge generated by reasoning or retrieved from long-term memory, and core information carried over from previous cycles (e.g., active goals). LLM input is synthesized from it, and LLM output is parsed back into it.","Serves as the central hub connecting different components of a language agent (LLM, long-term memories, grounding interfaces), enabling context-aware and responsive decision-making.","['Modular Memory', 'Reasoning Actions', 'Structured Output Parsing']","Cognitive architectures (Soar), language agents (CoALA framework), prompt templates and variable population for LLM calls.","['Agentic AI', 'Knowledge & Reasoning']",29,
90,Episodic Memory,"How to store and leverage experience from earlier decision cycles, past behaviors, or event flows for future reasoning, learning, or planning.","Agents needing to learn from their history, retrieve relevant past events, or reflect on sequences of actions and observations to adapt their behavior.","A memory module that stores representations of the agent's experiences, such as training input-output pairs, history event flows, or game trajectories. These episodes can be retrieved into working memory during the planning stage to support reasoning.","Allows agents to access and learn from their past, enabling recall of relevant examples, bases for reasoning, and support for learning by storing new experiences.","['Modular Memory', 'Learning Actions', 'Reflection / Self-Improvement']","RL agents storing episodic trajectories, Generative Agents (storing events), support for reasoning and decision-making in language agents.","['Agentic AI', 'Knowledge & Reasoning']",29,
91,Semantic Memory,"How to store and access an agent's explicit knowledge about the world and itself, including facts, concepts, and general information.","Agents requiring external knowledge support for reasoning or decision-making, or needing to incrementally build up their understanding of the world from experience.","A memory module that stores an agent's knowledge about the world and itself, often initialized from external databases (e.g., Wikipedia) or game manuals. Language agents may also write new knowledge obtained from LLM reasoning into semantic memory as a form of learning.","Provides a knowledge base that can be retrieved to inform reasoning and decision-making, allowing agents to ground their understanding and incrementally build world knowledge.","['Modular Memory', 'Retrieval Augmented Generation (RAG)', 'Learning Actions', 'Reflection / Self-Improvement']","Retrieval-augmented NLP methods, reading-to-learn RL approaches, Generative Agents (storing reflections), robotics (semantic maps).","['Agentic AI', 'Knowledge & Reasoning']",29,
92,Procedural Memory,"How to store the agent's operational knowledge, including its rules of behavior, skills, and how to implement actions and decision-making processes.",Agents requiring both implicit (learned via weights) and explicit (coded rules and procedures) knowledge to define their behavior and control flow.,"Comprises two forms: implicit knowledge stored in the LLM weights, and explicit knowledge written in the agent's code. Explicit knowledge includes procedures for implementing actions (reasoning, retrieval, grounding, learning) and procedures for decision-making itself. Learning actions can update this memory by writing new agent code.","Defines the agent's capabilities and control flow, allowing for both the flexible, implicit knowledge of LLMs and the interpretable, extensible (but potentially brittle) explicit code.","['Modular Memory', 'Code as Policies / Skill Library', 'Learning Actions', 'LLM-Code Hybrid Control']","Cognitive architectures (Soar), language agents (CoALA framework), Voyager (skill library), prompt templates.","['Agentic AI', 'Knowledge & Reasoning']",11,
93,Structured Action Space,"How to systematically define the range of actions an agent can take, encompassing both interactions with the external world and internal cognitive processes, for clear and task-suitable agent design.","Designing language agents that need to perform complex tasks requiring both external manipulation (e.g., controlling a robot, using tools) and internal deliberation (e.g., reasoning, memory access, learning).","Divide the agent's action space into two main categories: external actions (interacting with external environments through 'grounding') and internal actions (interacting with internal memories and processes, further decomposed into retrieval, reasoning, and learning).","Provides a clear and task-suitable set of capabilities for the agent, enabling the design of more complex and autonomous systems by systematically considering all possible operations.","['Grounding Actions', 'Retrieval Actions', 'Reasoning Actions', 'Learning Actions', 'Modular Agent Design']","Language agent design (CoALA framework), reinforcement learning, cognitive architectures.","['Agentic AI', 'Tools Integration']",11,
94,Grounding Actions,"How to connect an agent's internal (often language-based) representations and decisions to its external environment, enabling it to perceive and act in the real or digital world.","Language agents needing to interact with physical robots, engage in dialogue with humans, or manipulate digital interfaces (games, APIs, websites) where direct LLM output is insufficient.","Procedures that execute external actions (e.g., motor commands, API calls, natural language responses) and process environmental feedback (e.g., sensor data, website observations, human dialogue) into textual representations for the agent's working memory.","Allows language models to operate in interactive environments, translating high-level instructions into concrete actions and observations into text, effectively simplifying external interaction to a 'text game'.","['Structured Action Space', 'Tool Use / Digital Grounding']","Robotics (Ahn et al. 2022), web manipulation (Yao et al. 2022a), human-agent dialogue, game interaction.","['Tools Integration', 'AI-Human Interaction', 'Agentic AI']",8,
95,Retrieval Actions,"How to efficiently access and bring relevant information from an agent's long-term memories (episodic, semantic, procedural) into its working memory for current decision-making.","Agents needing to leverage stored experiences, world knowledge, or operational skills to inform their reasoning, planning, or to provide context-specific information.","A procedure that reads information from long-term memory modules into working memory. This can be implemented using various methods such as rule-based, sparse, or dense retrieval, depending on the information and memory type.","Enhances decision-making by providing context-specific information from the agent's knowledge base and history, improving the agent's ability to plan and reason.","['Structured Action Space', 'Modular Memory', 'Retrieval Augmented Generation (RAG)']","Voyager (loading code-based skills), Generative Agents (retrieving relevant events), DocPrompting (leveraging library documents), supporting planning stages in decision cycles.","['Knowledge & Reasoning', 'Agentic AI']",29,
96,Reasoning Actions,"How to process the contents of working memory to generate new information, distill insights, or elaborate on observations, supporting learning and decision-making.","Language agents needing to analyze recent observations, summarize trajectories, or process retrieved information to form new conclusions or intermediate steps before acting or learning.","Procedures that read from and write to working memory, often using the LLM itself to summarize, distill insights, or infer new information about observations, trajectories, or retrieved facts.","Supports learning by generating results that can be written into long-term memory, and enhances decision-making by providing additional context or intermediate steps for subsequent LLM calls.","['Structured Action Space', 'Working Memory', 'Chain-of-Thought (CoT) Prompting', 'Reflection / Self-Improvement']","ReAct (analyze situation, remake action plans), Generative Agents (generate reflections), Tree of Thoughts (propose thoughts), creating additional context for LLM prompts.","['Knowledge & Reasoning', 'Agentic AI', 'LLM-specific']",29,
97,Learning Actions,"How to enable an agent to acquire new knowledge, skills, or modify its behavior over its lifetime by committing information to long-term memory.","Agents needing to adapt to new environments, improve performance, or build up their internal representations of the world and their capabilities.","Procedures that involve writing information to long-term memory modules (episodic, semantic, procedural) or updating LLM parameters. This spectrum includes storing experiences, inferred knowledge, finetuning LLMs (implicit procedural knowledge), or modifying agent code (explicit procedural knowledge).","Allows agents to continuously improve, adapt, and build a richer internal model of the world and their own capabilities, leading to efficient lifelong learning.","['Structured Action Space', 'Modular Memory', 'Episodic Memory', 'Semantic Memory', 'Procedural Memory', 'Reflection / Self-Improvement', 'Metalearning for Agents']","Voyager (adding new grounding procedures), Generative Agents (storing reflections), Reflexion (storing inferences from failed episodes), finetuning LLMs via supervised or reinforcement learning.","['Agentic AI', 'MLOps', 'Knowledge & Reasoning']",29,
98,Generalized Decision-Making Loop,"How to structure the top-level control flow of a language agent to enable deliberate, multi-step planning and action selection, moving beyond direct, single-step action generation.","Agents facing complex tasks where a direct action might not be optimal, requiring foresight, evaluation of alternatives, and iterative refinement of plans.","A repeated decision cycle that yields an external (grounding) action or an internal (learning) action. In each cycle, program code defines a sequence of reasoning and retrieval actions to propose and evaluate alternatives (planning stage), then executes the selected action (execution stage), and the cycle loops again after an observation.","Enables agents to engage in more sophisticated, deliberative behaviors, including iterative improvement of plans and consideration of multiple alternatives, leading to more robust and intelligent actions.","['Cognitive Architecture', 'Propose-Evaluate-Select Planning', 'Reasoning Actions', 'Retrieval Actions']","CoALA framework for language agents, Tree of Thoughts, RAP (Reasoning and Acting with Planning).","['Planning', 'Agentic AI']",17,
99,Propose-Evaluate-Select Planning,"Within a generalized decision cycle, how to systematically generate, assess, and choose among multiple possible actions or 'thoughts' to make informed decisions.","Agents needing to consider potential outcomes and optimize for desired goals in complex situations where a direct action is insufficient, requiring deliberation.","A substage within the planning stage of a decision loop, comprising three steps: 1) Proposal: Generating one or more action candidates (e.g., via LLM sampling, code structures, simulators). 2) Evaluation: Assigning a value to each candidate (e.g., heuristic rules, LLM perplexity, learned values, internal simulation). 3) Selection: Choosing the best action based on evaluation (e.g., argmax, softmax, majority vote) or rejecting candidates and looping back to proposal.","Enables agents to make more informed and robust decisions by considering potential outcomes, optimizing for desired goals, and allowing for iterative improvement of candidate solutions.","['Generalized Decision-Making Loop', 'Reasoning Actions', 'Tree of Thoughts (ToT)']","Classical planning algorithms, Tree of Thoughts, RAP, advanced language agents.","['Planning', 'Agentic AI']",17,
100,Language Models as Probabilistic Production Systems,"How to conceptually link modern LLMs to classical AI formalisms, understanding their generative capabilities in a structured way that supports agent design.",Drawing parallels between LLMs and historical production systems to build a theoretical foundation for cognitive language agents and apply control mechanisms.,"View an LLM as defining a probability distribution over which 'productions' (string completions or modifications) to select when presented with an input (prompt), yielding a distribution P(Y|X). This treats the LLM as sampling a possible completion each time it is called.","Provides a theoretical bridge between symbolic AI and LLMs, suggesting that control mechanisms from cognitive architectures, originally used with production systems, can be equally applicable to transform LLMs into language agents.","['Production System', 'Cognitive Language Agent']","Conceptual framework for LLM behavior, foundation for LLM-based agent design, understanding LLM's role in a cognitive architecture.","['LLM-specific', 'Generative AI', 'Classical AI']",11,
101,Prompt Engineering,"How to guide or bias the output of an LLM towards high-quality, task-specific responses or to elicit targeted reasoning, without altering its internal weights.","Using LLMs for various tasks where their general knowledge needs to be focused, or their reasoning capabilities need to be enhanced for specific problems.","Preprocessing the input string (the prompt) by concatenating additional text, few-shot examples, instructions, or external observations to influence the LLM's conditional distribution over completions. These manipulations can be seen as 'productions' themselves.","Allows users to elicit targeted reasoning and desired outputs, making LLMs more versatile for specific tasks, and serving as a form of task-specific prioritization of productions.","['Zeroshot Prompting', 'Fewshot Prompting', 'Retrieval Augmented Generation (RAG)', 'Socratic Models', 'Self-Critique Prompting', 'Chain-of-Thought (CoT) Prompting', 'Prompt Chaining']","Question answering, code generation, various NLP tasks, biasing LLMs towards specific behaviors or reasoning processes.","['Prompt Design', 'LLM-specific']",18,
102,Zeroshot Prompting,"How to make an LLM perform a task it hasn't been explicitly trained for, with minimal or no examples, relying solely on its pre-trained knowledge.","Applying LLMs to novel tasks where labeled data for finetuning is unavailable, too costly, or when a quick, initial solution is needed.","Formulating the task directly as an input string (a question or instruction) to the LLM, expecting it to generate a relevant completion or answer based on its vast pre-training corpus.","Enables immediate application of LLMs to a wide range of tasks 'out of the box' without task-specific examples, leveraging their implicit world knowledge.",['Prompt Engineering'],"General question answering, simple instruction following, initial exploration of LLM capabilities for a new task.","['Prompt Design', 'LLM-specific']",18,
103,Fewshot Prompting,"How to improve an LLM's performance on a specific task by providing a small number of in-context examples, especially when finetuning is not feasible or desired.","Tasks where zeroshot performance is insufficient, but full finetuning is impractical due to data scarcity, cost, or a desire for rapid adaptation.","Including a few input-output examples directly in the prompt, demonstrating the desired task behavior before presenting the actual query. These examples guide the LLM's inference for the new input.","Biases the LLM towards high-quality productions relevant to the task, improving accuracy and adherence to desired formats by showing the model 'how' to respond.",['Prompt Engineering'],"Adapting LLMs to novel tasks with limited data, improving specific task performance, demonstration-based learning.","['Prompt Design', 'LLM-specific']",18,
104,Retrieval Augmented Generation (RAG),"How to ground LLM generations in external, up-to-date, or specific knowledge, mitigating hallucinations, outdated information, and limitations of the LLM's internal knowledge base.","LLMs needing to answer questions or generate text that requires specific factual information not present in their training data, or to be current and attributable.","Preprocessing the prompt by retrieving relevant external observations or documents (e.g., from Wikipedia, databases, or specialized knowledge bases) and concatenating them with the original query before passing it to the LLM.","LLMs can generate more accurate, grounded, and up-to-date responses by leveraging external knowledge sources, reducing hallucinations and improving factual consistency.","['Prompt Engineering', 'Semantic Memory', 'Retrieval Actions']","Knowledge-intensive NLP tasks, open-domain question answering, fact-checking, generating text with specific external context.","['Prompt Design', 'Knowledge & Reasoning', 'Generative AI', 'LLM-specific']",3,
105,Socratic Models,"How to combine different specialized models (e.g., vision, language) to perform complex multimodal reasoning, orchestrating their individual strengths.","Tasks requiring processing of multiple modalities (e.g., image and text) where a single LLM might not be sufficient or efficient, and modularity is desired.","Using an LLM as a central orchestrator that queries other specialized models (e.g., a Vision-Language Model for observations) to translate perceptual data into text, and then integrates their outputs into its reasoning process.","Enables multimodal reasoning by leveraging the strengths of different models, with the LLM providing high-level control and coherence for complex tasks.","['Prompt Engineering', 'Tools Integration', 'Grounding Actions']","Multimodal question answering, embodied reasoning, integrating specialized perception models with LLMs.","['Prompt Design', 'Generative AI', 'Tools Integration', 'LLM-specific']",26,
106,Self-Critique Prompting,"How to enable an LLM to evaluate and refine its own outputs, improving quality and correctness without relying solely on external human feedback.","Improving the reliability, accuracy, or creativity of LLM generations, especially for tasks where a single pass might produce errors, suboptimal results, or require iterative improvement.","After an initial generation, the LLM is prompted again, often with its previous output and a specific request to critique, identify defects, or propose modifications. This can occur in multiple iterations, allowing the LLM to act as its own evaluator.","Leads to iterative refinement and potentially higher-quality, more accurate outputs by allowing the LLM to identify and correct its own mistakes, mimicking human self-correction.","['Prompt Engineering', 'Reasoning Actions', 'Reflection / Self-Improvement', 'Prompt Chaining']","Improving code, creative writing, complex problem-solving, self-evaluation in agents.","['Prompt Design', 'Generative AI', 'LLM-specific']",23,
107,Chain-of-Thought (CoT) Prompting,"How to enable LLMs to perform complex reasoning tasks that require multiple intermediate steps, making their decision process more transparent and accurate.","Tasks that humans would solve by breaking them down into logical steps (e.g., arithmetic, multi-step logical problems), where direct generation often fails or produces incorrect results.",Prompting the LLM to generate a series of intermediate reasoning steps before providing the final answer. This can be achieved by adding explicit instructions like 'Let's think step by step' or by providing few-shot examples that include the desired reasoning process.,"Elicits more deliberate and accurate reasoning, improving performance on arithmetic, common sense, and symbolic reasoning tasks, and making the LLM's process more interpretable.","['Prompt Engineering', 'Reasoning Actions']","Complex problem-solving, arithmetic, logical reasoning, improving transparency of LLM decisions.","['Prompt Design', 'Generative AI', 'LLM-specific']",26,
