Pattern Name,Problem,Context,Solution,Result,Related Patterns,Uses,Cluster Number,Category
LLM-Augmented Knowledge Base,"Traditional knowledge graphs for recommender systems are often sparse, limited, and expensive to construct or complete, leading to ignored user preferences and suboptimal recommendations. They also lack comprehensive cross-domain information.","Recommender systems that rely on knowledge graphs for rich semantic information, improved accuracy, and explainability.","Leverage Large Language Models (LLMs) for their ability to retrieve factual knowledge, complete missing facts, and construct knowledge graphs (including entity discovery, coreference resolution, and relation extraction) from text corpora. LLMs can also distill common sense facts into knowledge graphs.","More extensive, up-to-date, and comprehensive knowledge graphs, leading to enhanced recommendation accuracy, relevance, personalization, and improved cross-domain recommendation capabilities.","['LLM as Semantic Content Encoder', 'Tool-Augmented LLM']","Recommender systems, cross-domain recommendations, knowledge graph completion, knowledge graph construction.",0,
LLM as Semantic Content Encoder,"Traditional content-based recommenders struggle to capture deep semantic representations and world knowledge from textual features, leading to limited understanding of item properties and user preferences. This also impacts cold-start and cross-domain recommendation scenarios.","Recommender systems that need to process and understand textual content (e.g., item descriptions, reviews, news articles) to infer user preferences and item properties.","Utilize pretrained Large Language Models (LLMs) as powerful semantic encoders to transform textual data into rich, context-aware feature embeddings. This involves adapting LLMs through fine-tuning or task-specific pretraining to align with recommendation objectives. Techniques like knowledge distillation and model optimization can be employed to reduce inference latency for online serving.","Enhanced understanding and interpretation of textual content, improved feature representations, better capture of user interests and item properties, and alleviation of cold-start and cross-domain recommendation challenges.","['Instruction Tuning for Recommendation', 'LLM-Augmented Knowledge Base']","Content-based recommender systems, news recommendation, sequential recommendation, tag recommendation, cold-start recommendation, cross-domain recommendation.",0,
Instruction Tuning for Recommendation,General-purpose Large Language Models (LLMs) are not inherently optimized for diverse recommendation tasks and may perform poorly in zero-shot or few-shot scenarios without specific adaptation.,"Adapting general LLMs to effectively perform various recommendation tasks (e.g., rating prediction, item recommendation, sequential recommendation, personalized search) and generalize across domains.","Formulate recommendation tasks as instruction-following procedures. This involves designing various instruction templates to accommodate different recommendation tasks, generating high-quality instruction data by converting user interaction history, retrieved candidates, and potentially LLM-generated reasoning features into natural language instructions, and then fine-tuning LLMs with this instruction data.","LLMs demonstrate superior performance in few-shot learning and cross-domain generalization for recommendation tasks, effectively handling a wide range of user information requirements.","['LLM as Semantic Content Encoder', 'LLM as Direct Recommender (via In-Context Learning)', 'LLM as Conversational Recommender Agent', 'LLM as Personalized AIGC Creator']","Sequential recommendation, rating prediction, item recommendation, personalized search, cross-domain recommendation, domain adaptation for conversational agents.",0,
LLM as Explainable Recommender,"Traditional recommender systems are often black boxes, leading to a lack of user trust. Existing explanation methods are often inflexible, lack diversity, coherence, and generalizability across different recommendation models.","Recommender systems where user trust and understanding of recommendations are crucial, and explanations need to be natural, customized, and model-agnostic.","Leverage Large Language Models (LLMs) for generating natural language explanations. LLMs can craft customized, precise, and adaptable explanations by harnessing their understanding of human language, context, and complex syntax. They utilize in-context learning (zero-shot, few-shot, Chain-of-Thought prompting) to generate explanations in real-time, incorporating user feedback and fostering human-machine alignment. This approach provides model-agnostic interpretations, explaining the reasoning behind recommendations from various underlying models.","Improved transparency, persuasiveness, and reliability of recommendations; enhanced user trust and satisfaction; more diverse, coherent, and adaptable explanations; and a versatile, scalable interpretational framework.","['Chain-of-Thought Prompting for Reasoning', 'LLM as Direct Recommender (via In-Context Learning)']","Explainable recommender systems, drug recommendations, general AI model interpretation.",0,
LLM as Direct Recommender (via In-Context Learning),"Adapting traditional recommendation models often requires extensive tuning and data. There's a need for flexible, quick adaptation to new recommendation tasks or domains, especially in zero-shot or few-shot scenarios.","Recommender systems requiring rapid deployment or adaptation to new tasks/domains, or operating with limited explicit training data.","Utilize Large Language Models (LLMs) with their in-context learning capabilities to directly generate recommendations. This involves providing natural language instructions and/or a few input-output pairs (shots) as demonstrations within the prompt. LLMs then generate recommendations (e.g., rating predictions, item rankings) without explicit fine-tuning. For ranking tasks, a candidate generation module might be integrated to narrow down items before LLM reranking.","Enables zero-shot and few-shot recommendations, quick adaptation to new tasks, and leverages LLMs' commonsense knowledge. Performance can be improved with multi-step reasoning strategies like Chain-of-Thought prompting.","['Chain-of-Thought Prompting for Reasoning', 'Instruction Tuning for Recommendation', 'LLM as Explainable Recommender']","Rating prediction, ranking prediction, sequential recommendation, direct recommendation, open-domain recommendations (movies, books).",0,
Chain-of-Thought Prompting for Reasoning,"Large Language Models (LLMs) may struggle with complex tasks requiring multi-step reasoning or logical deduction, leading to suboptimal or incorrect conclusions.","Tasks that can be broken down into intermediate steps, where explicit reasoning paths can guide the LLM towards a more accurate final answer.","Employ Chain-of-Thought (CoT) prompting strategies. This involves providing the LLM with prompts that include previous intermediate reasoning steps, or explicitly instructing the LLM to 'think step by step.' This can be combined with multi-step prompt designs (e.g., NIR for recommendation).","Elicits emergent reasoning abilities in LLMs, enabling them to solve complex tasks by breaking them into subproblems, improving accuracy and performance in tasks like mathematical word problems or multi-step recommendation.","['LLM as Explainable Recommender', 'LLM as Direct Recommender (via In-Context Learning)', 'Tool-Augmented LLM']","Complex task solving, mathematical word problems, multi-step recommendation, automated selection, general reasoning tasks.",0,
LLM for AutoML and Architecture Search,"Automated Machine Learning (AutoML) and Neural Architecture Search (NAS) are computationally expensive and complex, requiring iterative sampling and evaluation of architectures or features.","Optimizing ML models (e.g., recommender systems) by automatically searching for optimal embedding sizes, features, feature interactions, or model architectures.","Leverage Large Language Models (LLMs) for their generative, memorization, and reasoning capabilities to assist or perform AutoML tasks. This includes generating network architectures directly, acting as black-box agents to propose better-performing architectures based on previous trials, or integrating LLMs into existing search strategies (e.g., genetic algorithms) as mutation and crossover operators to generate candidate architectures or modifications.","Reduces the search space, generates reasonable architectures, and potentially improves the efficiency and effectiveness of AutoML processes for recommender systems and other ML tasks.",[],"Neural Architecture Search (NAS), automated feature selection, automated feature interaction search, general AutoML.",0,
LLM as Conversational Recommender Agent,"Building effective conversational recommender systems (CRS) requires real-time understanding of user intent, adaptation to feedback, and handling domain-specific knowledge and long conversation contexts. General LLMs lack awareness of private domain data and have token limits for long dialogues.",Developing interactive recommender systems that engage users in natural language dialogue to uncover preferences and provide personalized recommendations.,"Employ Large Language Models (LLMs) as the core of conversational recommender agents. This involves domain adaptation through fine-tuning LLMs with private, domain-specific dialogue data (potentially generated by LLM-based user simulators). It also includes tool integration, treating traditional recommendation models as external tools that the LLM can invoke to obtain recommendations, and memory augmentation by incorporating memory modules or user profile modules to store and retrieve meaningful, enduring facts about users from long conversations, overcoming token limits.","Enables LLMs to act as intelligent conversational agents, providing personalized recommendations, understanding user intent in real-time, adapting to feedback, and handling domain-specific knowledge and long dialogue histories.","['Tool-Augmented LLM', 'Memory-Augmented LLM', 'Instruction Tuning for Recommendation']","Conversational recommender systems, personalized assistance, customer service chatbots.",0,
Memory-Augmented LLM,"Large Language Models (LLMs) have limited context windows (token limits), making it challenging to maintain coherence and leverage historical information in long conversations or when dealing with extensive user profiles.","LLM-based applications (e.g., conversational agents, personalized systems) that require retaining and utilizing information from extended interactions or large knowledge bases beyond the immediate prompt.","Augment LLMs with external memory modules. This involves extracting meaningful and enduring facts about users from historical conversations and storing them in a dedicated user memory (e.g., a factual statement database). When processing new user queries, relevant facts are retrieved from the memory based on text similarity or other indexing mechanisms and incorporated into the LLM's prompt to provide context and enhance its long-dialogue memory capability.","Overcomes LLM token limits, improves comprehension and coherence in long conversations, enables better utilization of historical user information, and enhances the accuracy of personalized responses.","['LLM as Conversational Recommender Agent', 'Tool-Augmented LLM']","Conversational AI, personalized assistants, long-context understanding, user profile management.",0,
Tool-Augmented LLM,"Large Language Models (LLMs) have impressive general knowledge and reasoning but lack specific, up-to-date, or private domain knowledge, struggle with complex computations, and cannot directly interact with external systems or real-world environments. This limits their task-solving capabilities.","LLM-based systems needing to perform complex tasks that require specialized knowledge, real-time data, external computation, or interaction with other software/APIs.","Augment LLMs with external tools, where the LLM acts as a controller or orchestrator. The LLM comprehends user input, breaks down complex tasks into subtasks, and decides which specialized tools (e.g., search engines, recommendation engines, calculators, databases, other AI models, APIs) to invoke. It generates both reasoning paths and task-specific actions alternately (e.g., ReAct), delegating action execution to tools and using external feedback to guide further reasoning. Finally, the LLM integrates the outputs from the tools to complete the end-to-end task and present a coherent response. Advanced approaches may even empower LLMs to directly generate new tools.","Enhances LLMs' task-solving capabilities, provides access to external, up-to-date, and domain-specific knowledge, enables complex computations, and allows interaction with real-world systems, overcoming limitations like hallucinations and lack of domain awareness.","['LLM as Conversational Recommender Agent', 'Chain-of-Thought Prompting for Reasoning', 'LLM-Augmented Knowledge Base', 'Memory-Augmented LLM']","Conversational AI, personalized systems, complex task automation, question answering, code generation, visual tasks, web browsing, scientific reasoning, robotics.",0,
LLM as Personalized AIGC Creator,"Traditional recommender systems only suggest existing items. Creating customized, appealing content (e.g., ad titles, descriptions, images, music) that precisely matches individual user interests and preferences is labor-intensive and difficult to scale. User feedback for content generation is often sparse.","E-commerce, online advertising, customer service, and other domains where personalized, dynamically generated content can enhance user engagement and experience.","Leverage Large Language Models (LLMs) and AI-Generated Content (AIGC) techniques to create personalized content. LLMs reason about user personalized intent and interests from instructions or feedback, then generate various forms of content (text, images, multimodal) based on their knowledge and the inferred user intent. Strategies like Reinforcement Learning from Human Feedback (RLHF) or iterative conversational feedback are employed to fine-tune LLMs, allowing them to better capture explicit user preferences and guide content generation. LLMs' cross-modal knowledge bases can be utilized for realistic and diverse content creation.","Efficient and accessible creation of highly customized and appealing content, improved user engagement, alleviation of sparse feedback problems in content generation, and enhanced personalized experiences across various business scenarios.","['Instruction Tuning for Recommendation', 'LLM as Conversational Recommender Agent']","Online advertising, e-commerce product descriptions, customer service chatbots, personalized media generation (images, music).",0,
Agent-Computer Interface (ACI),"Language Model (LM) agents struggle to reliably interact with complex digital environments (like software engineering tools) when using interfaces designed for humans (e.g., Linux shell), leading to poor performance, inefficient actions, and difficulty in error recovery.","LM agents are tasked with complex, multi-step operations in digital environments (e.g., software engineering, code generation, navigation). Existing human-centric interfaces are not optimized for LM capabilities and limitations (e.g., lack of visual understanding, fixed cost of context window, difficulty with verbose or unstructured information).","Introduce an abstraction layer, an Agent-Computer Interface (ACI), between the LM agent and the computer. This interface provides a tailored set of commands and structured feedback, designed to complement the LM's abilities and mitigate its weaknesses. It manages context, simplifies actions, and incorporates guardrails to enhance reliability and efficiency.","Substantially enhances LM agents' ability to perform complex tasks, improving performance, efficiency, and error recovery compared to using human-centric interfaces. It unifies tool use, prompting techniques, and code execution within a single framework.","['Concise and Structured Environment Feedback', 'Guardrails for Agent Actions', 'Compact and Efficient Agent Actions']","Automated software engineering, digital environment interaction for LM agents, code generation, web navigation, computer control, any domain where LM agents interact with complex systems.",0,
Concise and Structured Environment Feedback,"Language Model (LM) agents are sensitive to context window size and distracting information. Verbose or unstructured environment feedback can consume excessive tokens, reduce performance, and make it difficult for the agent to identify relevant information.","LM agents interact with digital environments, receiving observations after each action. All content in the context window has a fixed cost in memory and computation for LMs, and distracting context can harm performance.","Design environment feedback to be informative but concise. This includes providing substantive information about the current state and action effects without unnecessary details, contextualizing code snippets (e.g., with prepended line numbers, indicators of omitted lines), and collapsing old observations into single-line summaries to maintain essential information while reducing unnecessary context.","Improves LM agent efficiency by reducing context window bloat, allowing more interaction cycles, and enhancing the agent's ability to focus on relevant information, leading to better downstream task performance and reduced cost.","['Agent-Computer Interface (ACI)', 'Guardrails for Agent Actions', 'Compact and Efficient Agent Actions']","Any LM agent interacting with a digital environment, especially for code editing, file navigation, debugging, and managing long-running tasks where context management is critical.",0,
Guardrails for Agent Actions,"Language Model (LM) agents make mistakes (e.g., syntax errors in code edits, malformed commands, overly broad searches) and struggle to recover from these errors. This leads to cascading failures, wasted turns, and increased computational cost.","LM agents perform actions in a digital environment where errors can have significant negative consequences (e.g., invalid code breaking the system, inefficient searches consuming budget). Recovery from self-incurred errors is difficult for LMs.","Implement guardrails within the agent-computer interface to automatically detect and prevent common mistakes or provide immediate, specific feedback for recovery. Examples include a code syntax checker for edits (discarding invalid edits and prompting retry), limiting verbose search results (suggesting more specific queries), and providing error responses for malformed generations.","Mitigates error propagation, hastens recovery from mistakes, and improves the reliability and efficiency of agent actions, leading to higher task success rates and reduced wasted resources.","['Agent-Computer Interface (ACI)', 'Concise and Structured Environment Feedback', 'Compact and Efficient Agent Actions']","Automated software engineering, any agentic system where action validity and error recovery are critical, robust ML workflow execution, prompt design for error handling.",0,
Compact and Efficient Agent Actions,"Language Model (LM) agents can be inefficient when performing higher-order operations that require composing many simple, granular actions across multiple turns. This leads to increased cost, context window usage, and slower progress towards a goal.","LM agents interact with digital environments using a set of available commands. Granular commands (like many bash commands) require complex composition for common tasks, which is not efficient for LMs due to their sequential nature and context limitations.","Consolidate important operations (e.g., multi-line file editing, efficient search, file navigation) into as few actions as possible. Provide simple commands with concise documentation and few options. Design actions to make meaningful progress towards a goal in a single step, rather than requiring composition across multiple turns.","Improves agent efficiency by reducing the number of turns required for complex tasks, lowering computational cost, and making actions easier for agents to use reliably, thereby accelerating problem-solving and improving overall performance.","['Agent-Computer Interface (ACI)', 'Concise and Structured Environment Feedback', 'Guardrails for Agent Actions']","Automated software engineering, digital environment interaction, task planning for agents, optimizing LLM agent workflows, robotics for high-level action abstraction.",0,
LLM-Assisted Symbolic World Model Construction,"Large Language Models (LLMs) directly used as planners are impractical due to limited correctness of plans, strong reliance on online feedback from interactions with simulators or the actual environment, and inefficiency in utilizing human feedback for complex, long-horizon planning tasks.","Designing AI agents for sequential decision-making or planning problems where reliability and correctness are paramount. Users may not be experts in formal planning languages (like PDDL), and the system needs to leverage LLMs' common-sense knowledge for knowledge acquisition and representation.","Leverage LLMs to construct an explicit, symbolic world model (e.g., in PDDL) from natural language descriptions of actions and domains. The LLM also acts as an interface, translating the symbolic model to natural language for human inspection and incorporating natural language corrective feedback (from humans or automated validators) back into the symbolic model through an iterative dialogue. This corrected symbolic model is then used by sound, domain-independent planners.","Provides correctness guarantees from external planners, reduces human involvement by shifting correction effort to the model construction phase, and conceals the complexity of formal planning languages from non-expert users. It enables LLMs to excel at modeling causal dependencies rather than combinatorial search.","['LLM with External Tools', 'Corrective Reprompting / Iterative Plan Refinement', 'LLM as Heuristic/Seed Planner']","Task planning for embodied agents (e.g., household robots), classical planning domains (e.g., IPC domains), knowledge acquisition for AI agents.",0,
LLM as Heuristic/Seed Planner,"Off-the-shelf LLMs often struggle to produce fully accurate and executable plans for complex tasks due to limitations in reasoning and handling long-term dependencies, but they can provide sensible high-level guidance or initial suggestions based on their broad common-sense knowledge.","Planning problems where an LLM's common-sense knowledge can be beneficial for guiding the search, but its direct planning capabilities are insufficient for generating reliable, executable plans. The system needs to combine the strengths of LLMs with the precision of specialized planners.","Use an LLM to generate a preliminary, high-level plan, score potential actions, or provide a 'seed' plan. This LLM output is then passed to a more specialized, reliable external planner (e.g., a classical domain-independent planner, a low-level grounding planner, or a local-search planner) which refines, validates, or grounds these suggestions to determine executability and ensure correctness.","Improves the overall planning process by combining the LLM's broad knowledge and high-level reasoning with the precision and correctness of specialized planners, potentially accelerating plan search and making it more robust.","['LLM with External Tools', 'LLM-Assisted Symbolic World Model Construction']","Robotics (e.g., scoring high-level actions, grounding actions), accelerating local-search planners, general sequential decision-making, hybrid planning systems.",0,
LLM with External Tools,"Large Language Models (LLMs) are approximately omniscient but may not always outperform specialized models or tools in specific, precise, or computationally intensive subtasks (e.g., arithmetic, logical reasoning, sound planning, factual retrieval, code execution).","Designing AI systems where an LLM needs to perform tasks that require capabilities beyond its inherent generative or reasoning abilities, or where higher reliability and accuracy are required for specific sub-components. The LLM needs to act as an orchestrator.","Enable the LLM to identify when an external tool is needed, formulate appropriate input for that tool, invoke the tool, and then interpret and integrate the tool's output back into its reasoning or generation process. This creates a hybrid system where the LLM orchestrates specialized tools to achieve complex goals.","Augments the LLM's capabilities, leading to more reliable, accurate, and robust performance on complex tasks by offloading specialized subtasks to dedicated, proven tools. It allows LLMs to act as controllers or orchestrators for a suite of specialized functionalities.","['LLM-Assisted Symbolic World Model Construction', 'LLM as Heuristic/Seed Planner', 'Corrective Reprompting / Iterative Plan Refinement']","Arithmetic, logical reasoning, planning, code generation, data retrieval, interacting with APIs, scientific computation, embodied agents.",0,
