Pattern Name,Problem,Context,Solution,Result,Related Patterns,Uses,Cluster Number,Category
Isolate and Validate Output of Model,"Machine learning models are known to be unstable, vulnerable to adversarial attacks, noise in data, and data drift over time.","Deploying ML models in production environments where robustness, security, and reliability are critical.",Encapsulate ML models within rule-based safeguards and use redundant and diverse architectures to mitigate and absorb the inherent low robustness of ML models.,"Enhances the robustness, security, and reliability of deployed ML models against various vulnerabilities, including attacks, noise, and data drift.",['Canary Model'],"Critical ML applications, models deployed in dynamic or adversarial environments, systems requiring high model integrity.",12,
Canary Model,A surrogate ML model that approximates the behavior of the best ML model must be built to provide explainability or monitor subtle changes in prediction behavior.,"Deploying new or monitoring existing ML models, especially for A/B testing, understanding behavior, or ensuring safe deployment.",Run a canary (surrogate) inference pipeline in parallel with the primary inference pipeline to continuously monitor and compare prediction differences.,"Provides a mechanism for monitoring prediction differences, aiding in model explainability, detecting regressions, and enabling safer deployment strategies.",['Isolate and Validate Output of Model'],"Model monitoring, A/B testing for ML models, explainable AI, safe model deployment.",12,
Design Holistically about Data Collection and Feature Extraction,"The system to prepare data in an ML-friendly format can easily become a 'pipeline jungle,' making management difficult and costly.","Designing and managing data pipelines for machine learning, especially for data collection and feature engineering.","Avoid complex, unmanageable 'pipeline jungles' by thinking holistically about the entire process of data collection and feature extraction from the outset.",Dramatically reduces ongoing costs and complexity by preventing the proliferation of unruly data pipelines for ML data preparation.,[],"Designing and managing ML data pipelines, MLOps data engineering.",28,
Secure Aggregation,"The system needs to communicate and aggregate model updates in a secure, efficient, scalable, and fault-tolerant way, particularly in distributed learning settings.",Federated Learning environments or other distributed ML scenarios where privacy of individual contributions to model updates must be maintained.,Encrypt data from each mobile device in Federated Learning and calculate totals and averages of model updates without individual examination of raw data.,Ensures privacy and security of individual contributions during collaborative model training while maintaining efficiency and scalability.,['Federated Learning'],"Federated Learning, privacy-preserving distributed ML, secure multi-party computation in AI.",29,
Two-Phase Predictions,"Executing large, complex ML models is time-consuming and costly, especially when lightweight clients (e.g., mobile, IoT devices) are involved.",Systems where predictions are needed on resource-constrained clients or where high-latency predictions from large models are undesirable for all requests.,"Split the prediction process into two phases: first, a simple, fast model is executed on the client, and then, optionally, a large, complex model is executed in the cloud for deeper insights.","Reduced prediction response time for some cases, decreased number of large, expensive predictions, and a fallback model available on the client even without internet connection.",[],Voice activation in AI assistants like Alexa or Google Assistant.,34,MLOps
Encapsulating ML Models within Rule-based Safeguards,"The inherent non-guarantee of correctness in ML model predictions makes them unsuitable for direct use in safety or security-related functions, and they are vulnerable to adversarial attacks, data noise, and drift.",AI systems operating in safety-critical or security-sensitive environments where the unreliability of ML models poses significant risks.,"Introduce a deterministic rule-based mechanism that evaluates and decides how to handle ML prediction results, often based on additional quality checks.","Reduced risk of negative impacts from incorrect predictions, but the architecture becomes more complex.",[],[],12,"Agentic AI, AIHuman Interaction"
AI Pipelines,Complex prediction or synthesis use cases are often difficult to accomplish effectively with a single AI tool or model.,"AI systems requiring a sequence of specialized AI processing steps to achieve a high-quality final result, such as in computer vision or complex natural language generation.","Divide the overall problem into smaller, consecutive steps. Then, combine several existing AI tools or custom models into an inference-time AI pipeline, with each specialized tool or model responsible for a single step.","Higher quality results, with the ability to optimize each step individually, but requires integrating more tools and models.",[],Typical computer vision inference pipelines.,31,"Tools Integration, Classical AI"
Ethics Credentials,"Responsible AI requirements are frequently omitted or stated as vague high-level objectives, lacking explicit, verifiable specifications as system outputs, leading to user distrust or non-adoption.","AI systems where user trust, ethical compliance, and accountability are paramount, but current methods for demonstrating these are insufficient.","Provide verifiable ethics credentials for the AI system or component, leveraging publicly accessible and trusted data infrastructure for verification. Users may also need to verify their credentials to access the system.","Increased trust and system acceptance, raised awareness of ethical issues. Requires a trusted public data infrastructure and ongoing maintenance/refresh of credentials.",[],[],48,AIHuman Interaction
Distinguish Business Logic from ML Model,"ML systems are complex due to regular retraining requirements and intrinsic non-deterministic behavior of ML components, alongside evolving business requirements and ML algorithms.","Any system integrating ML components where clear separation of concerns is needed between the stable business logic and the dynamic, evolving ML models.","Define clear APIs between traditional (business logic) and ML components. Structure the system into layers, separating business and ML components based on their distinct responsibilities, and divide data flows accordingly.",Improved manageability and adaptability of ML systems by isolating the volatile ML parts from the stable business logic.,[],[],13,MLOps
Microservice Vertical Pattern,Managing several ML inferences that need to run in a specific order or have dependencies on each other within an ML system.,"AI systems requiring sequential execution of multiple prediction models, where the output of one model serves as input for the next.","Deploy individual prediction models as separate services (servers or containers). Prediction requests are executed synchronously from top to bottom, with results gathered to form the final response to the client.",Facilitates ordered execution and dependency management for multi-stage ML inference.,[],[],40,"MLOps, Tools Integration"
Microservice Horizontal Pattern,"Workflows that can execute multiple ML predictions in parallel, or when multiple predictions need to be integrated into a single response for one request.","AI systems that benefit from parallel execution of independent prediction models to handle a single request, or where an ensemble of models is used.",Deploy multiple prediction models in parallel as separate services. A single request can be sent to these models simultaneously to acquire multiple predictions or an integrated prediction.,Enables efficient parallel inference and integration of results from multiple models for a single request.,[],[],40,"MLOps, Tools Integration"
Deploy Canary Model,"Uncertainty about whether a newly trained ML model, assumed to have better prediction quality, will perform as expected in production, and to mitigate risks of new model issues affecting all users.","MLOps environments where new ML models are frequently deployed and need rigorous, real-world validation before full rollout.","Deploy the new model alongside existing ones and route a small fraction of production requests to it. Evaluate its performance with this limited exposure. If successful, replace existing models; otherwise, improve the new model.","Minimizes user exposure to potential bugs or low-quality predictions from new models, but requires additional serving and monitoring infrastructure.",[],[],12,MLOps
Agent Profiling,"To enable autonomous agents to perform tasks by assuming specific roles (e.g., coders, teachers, domain experts) and to influence their Large Language Model (LLM) behaviors effectively.","LLM-based autonomous agents operating in various application scenarios where distinct personalities, expertise, or social interactions are required.","Indicate the agent's profiles, typically by writing this information into the prompt. Profiles can encompass basic (age, gender, career), psychological (personalities), and social information (relationships between agents). Three common strategies for creating profiles are:
1.  **Handcrafting:** Manually specifying profiles (e.g., 'you are an outgoing person').
2.  **LLM-generation:** Automatically generating profiles based on rules and optional seed examples using LLMs.
3.  **Dataset alignment:** Obtaining profiles from real-world datasets to accurately reflect attributes of a real population.","Serves as the foundation for agent design, significantly influencing the agent's memorization, planning, and action procedures, allowing for more human-like or role-specific behaviors.","['Memory-Augmented Agent', 'LLM as a Planner', 'Multi-Agent Debate']","Generative Agent (defining name, objectives, relationships), MetaGPT (predefining roles and responsibilities in software development), ChatDev, Self-collaboration, PTLLM (exploring personality traits), RecAgent (generating diverse user profiles for recommendations), American National Election Studies (assigning demographic roles to GPT-3 for social simulation).",35,
Memory-Augmented Agent,"Large Language Models (LLMs) have limited context windows, making it challenging for autonomous agents to accumulate experiences, self-evolve, maintain consistent behavior over long interactions, and perform long-range reasoning in dynamic environments.","LLM-based autonomous agents that need to store information perceived from the environment, recall past behaviors, and use recorded memories to facilitate future actions.","Equip the agent with a memory module that stores and manages information. This module often incorporates principles from human memory, such as:
*   **Hybrid Memory Structure:** Explicitly modeling short-term memory (input information within the context window) for recent perceptions and long-term memory (external vector storage, e.g., vector database) for consolidating important information over extended periods.
*   **Diverse Memory Formats:** Storing information in natural language, embeddings (for retrieval efficiency), databases (for efficient manipulation via SQL), or structured lists (e.g., hierarchical trees for goals/plans).
*   **Memory Operations:** Implementing mechanisms for:
    *   **Memory Reading:** Extracting meaningful information based on criteria like recency, relevance, and importance.
    *   **Memory Writing:** Storing new information, addressing memory duplication (e.g., condensing similar sequences, count accumulation) and overflow (e.g., explicit deletion, FIFO overwriting).
    *   **Memory Reflection:** Emulating human ability to independently summarize past experiences into broader, more abstract insights and infer high-level information.","Enhances the agent's ability to perceive recent contexts, accumulate valuable experiences, perform long-range reasoning, and behave in a more consistent, reasonable, and effective manner in complex environments.","['Agent Profiling', 'LLM as a Planner', 'Planning with Feedback', 'Self-Driven Evolution', 'Trial-and-Error Learning Agent', 'Tool-Augmented LLM Agent']","Generative Agent, AgentSims, Reflexion, GITM (Ghost in the Minecraft), SCM, SimplyRetrieve, MemorySandbox, MemoryBank, ChatDB, DBGPT, RETLLM, Voyager.",26,
LLM as a Planner,"Autonomous agents need to break down complex, long-horizon tasks into simpler subtasks and generate effective action plans, which is difficult to do directly and often requires human-like strategic thinking.",LLM-based autonomous agents facing complex tasks that require multi-step reasoning and decomposition to achieve a final goal.,"Leverage the inherent reasoning capabilities of Large Language Models (LLMs) to generate plans. This can be achieved through:
*   **Single-path Reasoning:** Decomposing the final task into a sequence of intermediate steps, where each step leads to a single subsequent step (e.g., Chain of Thought prompting).
*   **Multi-path Reasoning:** Organizing reasoning steps into a tree-like or graph structure, allowing for exploration of multiple choices or 'thoughts' at each intermediate step, with selection based on LLM evaluation (e.g., Tree of Thoughts, Self-consistent CoT).
*   **External Planner Integration:** Transforming task descriptions into formal planning languages (e.g., PDDL) for external, specialized planners, which then rapidly identify optimal action sequences, with LLMs converting results back to natural language.","Empowers agents with human-like planning capabilities, enabling them to behave more reasonably, powerfully, and reliably, especially for tasks that benefit from strategic decomposition and exploration of alternatives.","['Agent Profiling', 'Memory-Augmented Agent', 'Planning with Feedback', 'Tool-Augmented LLM Agent', 'Grounded Replanning']","Chain of Thought (CoT), ZeroshotCoT, RePrompting, ReWOO, HuggingGPT, Self-consistent CoT (CoTSC), Tree of Thoughts (ToT), RecMind, GoT, AoT, RAP, LLMP, LLMDP, COLLM, DEPS, GITM, Voyager.",0,
Planning with Feedback,"Generating a flawless plan directly from the beginning is extremely difficult for complex, long-horizon tasks, as it requires considering various complex preconditions and is susceptible to unpredictable environmental dynamics, leading to initial plans becoming non-executable.","LLM-based autonomous agents operating in dynamic, real-world, or complex simulated environments where plans need to be iteratively made and revised based on real-time information.","Design planning modules where the agent can receive and incorporate feedback after taking actions to iteratively revise its plans. Feedback can originate from:
*   **Environmental Feedback:** Objective signals from the world or virtual environment, such as task completion signals, observations after an action, execution errors, or scene graph updates.
*   **Human Feedback:** Subjective signals from human users to align agent plans with human values, preferences, and to mitigate hallucination problems.
*   **Model Feedback:** Internal feedback generated by the agents themselves or other pretrained models (e.g., self-refine mechanisms, evaluation modules, detailed verbal critiques) on the agent's output or reasoning steps.","Enables agents to create more adaptive, robust, and effective plans, recover from unexpected situations, and address complex tasks involving long-range reasoning by simulating human-like iterative planning.","['LLM as a Planner', 'Memory-Augmented Agent', 'Grounded Replanning', 'Trial-and-Error Learning Agent', 'Self-Driven Evolution']","ReAct, Voyager, Ghost, SayPlan, DEPS, LLMPlanner, Inner Monologue, Self-refine, SelfCheck, InterAct, ChatCoT, Reflexion.",16,
Grounded Replanning,"LLM-generated plans may become invalid or non-executable during execution in real-world or embodied environments due to discrepancies between the planned state and the actual environment (e.g., object mismatches, unattainable plans, unexpected dynamics).",Embodied agents or agents interacting with physical/simulated environments where plans require dynamic adjustment based on real-time observations and environmental changes.,"Implement an algorithm that dynamically updates or revises existing LLM-generated plans when environmental discrepancies or execution failures are encountered. This involves perceiving the current environment state, identifying mismatches with the plan, and re-planning from the updated, 'grounded' state.","Improves the robustness, adaptability, and success rate of agents in dynamic and uncertain environments, allowing them to recover from unexpected situations and complete long-horizon tasks.","['LLM as a Planner', 'Planning with Feedback', 'Trial-and-Error Learning Agent']","LLMPlanner, Inner Monologue (by adjusting strategies based on scene descriptions and human feedback).",16,
Tool-Augmented LLM Agent,"Large Language Models (LLMs) may lack comprehensive expert knowledge for specific domains, encounter hallucination problems, or be unable to directly interact with external systems or perform complex computations required for tasks.","LLM-based autonomous agents needing to expand their action space and capabilities beyond the internal knowledge of the LLM to address domain-specific challenges, access real-time information, or perform precise operations.","Empower agents with the capability to call and integrate external tools into their action module. These tools can include:
*   **APIs:** Leveraging external APIs (e.g., HuggingFace models, Python interpreters, LaTeX compilers, RESTful APIs) to execute sophisticated computations, extract relevant content, or generate specific inputs for other systems.
*   **Databases/Knowledge Bases:** Integrating external databases or knowledge bases (e.g., using SQL statements) to obtain specific domain information for generating more realistic and accurate actions.
*   **External Models:** Utilizing other specialized pretrained models (e.g., language models for text retrieval, Codex for code generation, multimodal models for video/image/audio processing) to handle more complex or multimodal tasks.","Greatly expands the agent's operational scope, mitigates LLM limitations (like hallucination and lack of domain expertise), and enables interaction with diverse real-world systems and data sources.","['LLM as a Planner', 'Memory-Augmented Agent', 'Planning with Feedback']","HuggingGPT, TPTU, Gorilla, ToolFormer, APIBank, ToolBench, RestGPT, TaskMatrixAI, MRKL, OpenAGI, MemoryBank, ViperGPT, ChemCrow, MMREACT, ChatDB, DBGPT, DEPS, Voyager, GITM, ChatDev, MetaGPT, Self-collaboration.",35,
Multi-Agent Debate,"Individual LLM-based agents may produce inconsistent, incomplete, or suboptimal responses to complex questions or tasks, and a single agent's perspective might be limited.","Scenarios where multiple LLM-based agents can collaborate to solve a problem or refine a decision, leveraging collective intelligence.","Design a mechanism where different agents provide separate responses or solutions to a given question or subtask. If their responses are not consistent, they are prompted to incorporate the solutions or opinions from other agents and provide an updated, refined response. This iterative process continues until a final consensus answer is reached or the quality of the solution is significantly improved.","Enhances the capability and robustness of each agent by leveraging the 'wisdom of crowds,' leading to more consistent, comprehensive, and accurate outcomes that benefit from diverse perspectives and iterative refinement.","['Agent Profiling', 'Self-Driven Evolution', 'Planning with Feedback']","91 (debating mechanism), RoCo (multirobot collaboration where agents discuss and improve plans), ChatEval (LLMs critique and assess model results in a debate format), ChatDev (agents communicate to collectively accomplish tasks), MetaGPT (roles supervise code generation).",42,
Self-Driven Evolution,"Enabling LLM-based agents to autonomously learn, adapt, and improve their capabilities over time in open-ended or long-term interactive environments, without explicit, pre-defined curricula or continuous human intervention.","Autonomous agents operating in dynamic environments where continuous learning, goal-setting, and adaptation are crucial for long-term effectiveness and acquiring new knowledge/skills.","Design agents with mechanisms that allow them to:
1.  **Autonomously Set Goals:** Define their own objectives based on their current state and environment.
2.  **Explore and Act:** Interact with the environment to gather information and perform actions.
3.  **Receive Feedback:** Obtain feedback (e.g., from a reward function, environmental observations, or other agents) on the outcomes of their actions.
4.  **Gradually Improve:** Leverage this feedback and accumulated experience to refine their strategies, acquire new knowledge, develop new skills, or adapt their roles and relationships. This process can involve internal reflection and communication within multi-agent systems.","Agents acquire knowledge and develop capabilities according to their own preferences or environmental demands, leading to greater autonomy, adaptability, and generalized performance in complex scenarios.","['Memory-Augmented Agent', 'Planning with Feedback', 'Trial-and-Error Learning Agent', 'Multi-Agent Debate']","LMA3 (autonomously set goals, explore, receive reward feedback), SALLMMS (multi-agent system adapts and performs complex tasks via communication), CLMTWA (teacher LLM improves student LLM's reasoning), NLSOM (agents communicate and collaborate, dynamic role adjustment), Voyager (skill execution code refinement), AppAgent (constructs knowledge base via exploration and observation).",10,
Trial-and-Error Learning Agent,Agents need to learn from failures and adapt their plans or actions in dynamic environments where a perfect initial plan is often unattainable and unexpected situations arise.,LLM-based agents performing actions in an environment where the outcomes can be objectively or subjectively judged as satisfactory or unsatisfactory.,"Implement a cycle where the agent first performs an action or proposes a plan. A predefined critic (which can be the environment, a human, or another model/LLM) then evaluates the outcome. If the action or plan is deemed unsatisfactory (e.g., fails, differs from desired outcome), the critic generates specific feedback (e.g., failure information, detailed reasons for failure). This feedback is then incorporated by the agent to react, redesign its plan, or iteratively refine its subsequent actions or strategies.","Enables agents to acquire adaptive behaviors, correct planning errors, and improve performance over time by learning directly from the consequences of their interactions and the detailed feedback received.","['Planning with Feedback', 'Memory-Augmented Agent', 'Self-Driven Evolution', 'Grounded Replanning']","RAH (user assistant compares predicted response with human feedback), DEPS (explainer generates details for plan failure), RoCo (plan and waypoints validated by environment checks, feedback appended to prompt for discussion), PREFER (LLMs generate feedback on reasons for failure to refine actions).",16,
